source_file,course_url,course_slug,reviewer_name,review_text,rating_value,rating_scale,review_time_relative
udemy_data (13).xlsx,https://www.udemy.com/course/ai-automation-build-llm-apps-ai-agents-with-n8n-apis/?couponCode=MT250929G3,ai-automation-build-llm-apps-ai-agents-with-n8n-apis,Mitesh A.,Arnie's explanations are very clear and touching the base for all the topics. Great learning with this course.,5.0,5.0,1 month ago
udemy_data (13).xlsx,https://www.udemy.com/course/ai-automation-build-llm-apps-ai-agents-with-n8n-apis/?couponCode=MT250929G3,ai-automation-build-llm-apps-ai-agents-with-n8n-apis,Amro E.,"very simple and useful got me hooked , thank you",5.0,5.0,3 months ago
udemy_data (13).xlsx,https://www.udemy.com/course/ai-automation-build-llm-apps-ai-agents-with-n8n-apis/?couponCode=MT250929G3,ai-automation-build-llm-apps-ai-agents-with-n8n-apis,Manu T.,Good course,5.0,5.0,2 months ago
udemy_data (13).xlsx,https://www.udemy.com/course/ai-automation-build-llm-apps-ai-agents-with-n8n-apis/?couponCode=MT250929G3,ai-automation-build-llm-apps-ai-agents-with-n8n-apis,Erick F.,Amazing course so far. Loving it.,5.0,5.0,3 months ago
udemy_data (13).xlsx,https://www.udemy.com/course/ai-automation-build-llm-apps-ai-agents-with-n8n-apis/?couponCode=MT250929G3,ai-automation-build-llm-apps-ai-agents-with-n8n-apis,Neeru W.,"amazing course , highly recommended",5.0,5.0,6 months ago
udemy_data (13).xlsx,https://www.udemy.com/course/ai-automation-build-llm-apps-ai-agents-with-n8n-apis/?couponCode=MT250929G3,ai-automation-build-llm-apps-ai-agents-with-n8n-apis,Pham Duong L.,"slow and easy to understand, the trainer really try hard to make his explanation basic and easy to understand",5.0,5.0,1 month ago
udemy_data (13).xlsx,https://www.udemy.com/course/ai-automation-build-llm-apps-ai-agents-with-n8n-apis/?couponCode=MT250929G3,ai-automation-build-llm-apps-ai-agents-with-n8n-apis,Estudiante E.,"Excelente intro al curso, buenos tips de entrada para pepararte y no abandonar en el medio. Gracias!",4.5,5.0,5 months ago
udemy_data (13).xlsx,https://www.udemy.com/course/ai-automation-build-llm-apps-ai-agents-with-n8n-apis/?couponCode=MT250929G3,ai-automation-build-llm-apps-ai-agents-with-n8n-apis,Roberto Valldeperas M.,This guy is a Genius.,5.0,5.0,2 months ago
udemy_data (13).xlsx,https://www.udemy.com/course/ai-automation-build-llm-apps-ai-agents-with-n8n-apis/?couponCode=MT250929G3,ai-automation-build-llm-apps-ai-agents-with-n8n-apis,Saliou D.,This RAG part is just amazing,5.0,5.0,4 months ago
udemy_data (13).xlsx,https://www.udemy.com/course/ai-automation-build-llm-apps-ai-agents-with-n8n-apis/?couponCode=MT250929G3,ai-automation-build-llm-apps-ai-agents-with-n8n-apis,Elevenia Digital Teknologi S.,"Really like the explanations, easy to understand and to the point.",5.0,5.0,2 weeks ago
udemy_data (13).xlsx,https://www.udemy.com/course/ai-automation-build-llm-apps-ai-agents-with-n8n-apis/?couponCode=MT250929G3,ai-automation-build-llm-apps-ai-agents-with-n8n-apis,Hemanth,Yes. Would appreciate some study materials on the content from the trainer. That would save us sometime researching ourselves,4.0,5.0,3 months ago
udemy_data (13).xlsx,https://www.udemy.com/course/ai-automation-build-llm-apps-ai-agents-with-n8n-apis/?couponCode=MT250929G3,ai-automation-build-llm-apps-ai-agents-with-n8n-apis,Parth J.,Amazing teacher. Great course! very honest and straight to the point.,5.0,5.0,2 months ago
udemy_data (13).xlsx,https://www.udemy.com/course/ai-automation-build-llm-apps-ai-agents-with-n8n-apis/?couponCode=MT250929G3,ai-automation-build-llm-apps-ai-agents-with-n8n-apis,Okan,"Arnie is great. Course is structured, detailed, easy to understand, recommended...",4.5,5.0,6 months ago
udemy_data (13).xlsx,https://www.udemy.com/course/ai-automation-build-llm-apps-ai-agents-with-n8n-apis/?couponCode=MT250929G3,ai-automation-build-llm-apps-ai-agents-with-n8n-apis,Fatima H.,"I’m really enjoying this course; it’s fun and easy to follow. However, I’m finding it difficult to follow along because the lessons aren’t well coordinated—especially when it comes to practical application. Jumping from one phase of automation development to a completely different topic breaks the continuity and makes it hard to stay on track.",4.0,5.0,5 months ago
udemy_data (13).xlsx,https://www.udemy.com/course/ai-automation-build-llm-apps-ai-agents-with-n8n-apis/?couponCode=MT250929G3,ai-automation-build-llm-apps-ai-agents-with-n8n-apis,野中和明,"DeepSeek do have Function Calling, check the url https://api-docs.deepseek.com/guides/function_calling",3.0,5.0,5 months ago
udemy_data (13).xlsx,https://www.udemy.com/course/ai-automation-build-llm-apps-ai-agents-with-n8n-apis/?couponCode=MT250929G3,ai-automation-build-llm-apps-ai-agents-with-n8n-apis,Patrick R K.,I cannot read German.,4.0,5.0,1 month ago
udemy_data (13).xlsx,https://www.udemy.com/course/ai-automation-build-llm-apps-ai-agents-with-n8n-apis/?couponCode=MT250929G3,ai-automation-build-llm-apps-ai-agents-with-n8n-apis,Shahroze D.,Very Impressive,4.5,5.0,2 months ago
udemy_data (13).xlsx,https://www.udemy.com/course/ai-automation-build-llm-apps-ai-agents-with-n8n-apis/?couponCode=MT250929G3,ai-automation-build-llm-apps-ai-agents-with-n8n-apis,Gil Jeremy D.,This course is easy to follow and phasing is good for begginers,5.0,5.0,1 month ago
udemy_data (13).xlsx,https://www.udemy.com/course/ai-automation-build-llm-apps-ai-agents-with-n8n-apis/?couponCode=MT250929G3,ai-automation-build-llm-apps-ai-agents-with-n8n-apis,caleb R.,great!,5.0,5.0,1 month ago
udemy_data (13).xlsx,https://www.udemy.com/course/ai-automation-build-llm-apps-ai-agents-with-n8n-apis/?couponCode=MT250929G3,ai-automation-build-llm-apps-ai-agents-with-n8n-apis,Miguel Gomez E.,"This has been a fantastic course so far, I am about half way through and I have learned a lot about n8n, the instructor is very clear with instructions and how to's of all llm models and n8n.",5.0,5.0,5 months ago
udemy_data (13).xlsx,https://www.udemy.com/course/ai-automation-build-llm-apps-ai-agents-with-n8n-apis/?couponCode=MT250929G3,ai-automation-build-llm-apps-ai-agents-with-n8n-apis,Bryan O.,yes. enjoyed learning on this topic,4.5,5.0,4 months ago
udemy_data (13).xlsx,https://www.udemy.com/course/ai-automation-build-llm-apps-ai-agents-with-n8n-apis/?couponCode=MT250929G3,ai-automation-build-llm-apps-ai-agents-with-n8n-apis,Warren M.,Content is good. Some of the English is hard to understand.,4.0,5.0,5 months ago
udemy_data (13).xlsx,https://www.udemy.com/course/ai-automation-build-llm-apps-ai-agents-with-n8n-apis/?couponCode=MT250929G3,ai-automation-build-llm-apps-ai-agents-with-n8n-apis,Samuel A.,The course has been highly informative so far and exactly what I need to educate myself about AI trends.,5.0,5.0,5 months ago
udemy_data (13).xlsx,https://www.udemy.com/course/ai-automation-build-llm-apps-ai-agents-with-n8n-apis/?couponCode=MT250929G3,ai-automation-build-llm-apps-ai-agents-with-n8n-apis,Борис,Very nice structure of the course and really excellent explanations!,5.0,5.0,4 months ago
udemy_data (13).xlsx,https://www.udemy.com/course/ai-automation-build-llm-apps-ai-agents-with-n8n-apis/?couponCode=MT250929G3,ai-automation-build-llm-apps-ai-agents-with-n8n-apis,Jackeline Goytia A.,Es dificil reconocer las opciones en la pantalla en aleman. Tengo que estar comparando mi pantalla con la de el autor.,4.0,5.0,5 months ago
udemy_data (13).xlsx,https://www.udemy.com/course/ai-automation-build-llm-apps-ai-agents-with-n8n-apis/?couponCode=MT250929G3,ai-automation-build-llm-apps-ai-agents-with-n8n-apis,Joshghun G.,So far so good!,5.0,5.0,1 month ago
udemy_data (13).xlsx,https://www.udemy.com/course/ai-automation-build-llm-apps-ai-agents-with-n8n-apis/?couponCode=MT250929G3,ai-automation-build-llm-apps-ai-agents-with-n8n-apis,Omprakash R.,The instructor is clear and the steps can be easily followed.,5.0,5.0,3 months ago
udemy_data (13).xlsx,https://www.udemy.com/course/ai-automation-build-llm-apps-ai-agents-with-n8n-apis/?couponCode=MT250929G3,ai-automation-build-llm-apps-ai-agents-with-n8n-apis,Jordan S.,Well thought out instructions broken down into easy to understand for a beginner like myself.,5.0,5.0,3 months ago
udemy_data (13).xlsx,https://www.udemy.com/course/ai-automation-build-llm-apps-ai-agents-with-n8n-apis/?couponCode=MT250929G3,ai-automation-build-llm-apps-ai-agents-with-n8n-apis,Hemant G.,"Nice tutorials, covers some real world scenarios.",5.0,5.0,4 months ago
udemy_data (13).xlsx,https://www.udemy.com/course/ai-automation-build-llm-apps-ai-agents-with-n8n-apis/?couponCode=MT250929G3,ai-automation-build-llm-apps-ai-agents-with-n8n-apis,Abdallah S.,I earn new things each video,5.0,5.0,5 months ago
udemy_data (13).xlsx,https://www.udemy.com/course/ai-automation-build-llm-apps-ai-agents-with-n8n-apis/?couponCode=MT250929G3,ai-automation-build-llm-apps-ai-agents-with-n8n-apis,Lamek K.,The course is really amazing,5.0,5.0,4 months ago
udemy_data (13).xlsx,https://www.udemy.com/course/ai-automation-build-llm-apps-ai-agents-with-n8n-apis/?couponCode=MT250929G3,ai-automation-build-llm-apps-ai-agents-with-n8n-apis,Eva,This course is very concise and easy to understand. It would be even better if there were some PPTs or pictures to illustrate the theoretical descriptions,4.5,5.0,2 months ago
udemy_data (13).xlsx,https://www.udemy.com/course/ai-automation-build-llm-apps-ai-agents-with-n8n-apis/?couponCode=MT250929G3,ai-automation-build-llm-apps-ai-agents-with-n8n-apis,MAHMOUD E.,"Until this moment, it's the theory but it worth watching, I hope all leaner not skipping even they already know, it will add more info to them and refresh their knowledge.",5.0,5.0,2 months ago
udemy_data (13).xlsx,https://www.udemy.com/course/ai-automation-build-llm-apps-ai-agents-with-n8n-apis/?couponCode=MT250929G3,ai-automation-build-llm-apps-ai-agents-with-n8n-apis,Anutr Y.,"Doesn't really jump to the practical but instead trying to explain every fundamental first, which is really good.",5.0,5.0,2 months ago
udemy_data (13).xlsx,https://www.udemy.com/course/ai-automation-build-llm-apps-ai-agents-with-n8n-apis/?couponCode=MT250929G3,ai-automation-build-llm-apps-ai-agents-with-n8n-apis,Sagar Y.,Amazing course !!,5.0,5.0,4 months ago
udemy_data (13).xlsx,https://www.udemy.com/course/ai-automation-build-llm-apps-ai-agents-with-n8n-apis/?couponCode=MT250929G3,ai-automation-build-llm-apps-ai-agents-with-n8n-apis,Muhammad T.,Cool!!,5.0,5.0,2 weeks ago
udemy_data (13).xlsx,https://www.udemy.com/course/ai-automation-build-llm-apps-ai-agents-with-n8n-apis/?couponCode=MT250929G3,ai-automation-build-llm-apps-ai-agents-with-n8n-apis,Nicolas G.,Impressive. Top content and engaging. Great work!,5.0,5.0,4 months ago
udemy_data (13).xlsx,https://www.udemy.com/course/ai-automation-build-llm-apps-ai-agents-with-n8n-apis/?couponCode=MT250929G3,ai-automation-build-llm-apps-ai-agents-with-n8n-apis,Omar A.,"very good course, I recommend it",5.0,5.0,4 months ago
udemy_data (13).xlsx,https://www.udemy.com/course/ai-automation-build-llm-apps-ai-agents-with-n8n-apis/?couponCode=MT250929G3,ai-automation-build-llm-apps-ai-agents-with-n8n-apis,Yap Kah Y.,Very clear and Informative,5.0,5.0,3 months ago
udemy_data (13).xlsx,https://www.udemy.com/course/ai-automation-build-llm-apps-ai-agents-with-n8n-apis/?couponCode=MT250929G3,ai-automation-build-llm-apps-ai-agents-with-n8n-apis,Kireev E.,Great course,5.0,5.0,3 weeks ago
udemy_data (13).xlsx,https://www.udemy.com/course/ai-automation-build-llm-apps-ai-agents-with-n8n-apis/?couponCode=MT250929G3,ai-automation-build-llm-apps-ai-agents-with-n8n-apis,Alvean M.,"Great and thorough explanations, much to learn and happy to work through these step by step towards using AI to increase productivity through automation and agents.",4.5,5.0,1 month ago
udemy_data (13).xlsx,https://www.udemy.com/course/ai-automation-build-llm-apps-ai-agents-with-n8n-apis/?couponCode=MT250929G3,ai-automation-build-llm-apps-ai-agents-with-n8n-apis,Serge P.,Great staff. Very clear and detailed.,5.0,5.0,4 months ago
udemy_data (13).xlsx,https://www.udemy.com/course/ai-automation-build-llm-apps-ai-agents-with-n8n-apis/?couponCode=MT250929G3,ai-automation-build-llm-apps-ai-agents-with-n8n-apis,JJ K.,"Other than taking a little bit to get adjusted to his accent, the course is fantastic. Clear, concise. Very good job at explaining some complex topics with examples.",5.0,5.0,4 months ago
udemy_data (13).xlsx,https://www.udemy.com/course/ai-automation-build-llm-apps-ai-agents-with-n8n-apis/?couponCode=MT250929G3,ai-automation-build-llm-apps-ai-agents-with-n8n-apis,Robert P.,Exceptional course in that topic. I strongly recommend it.,5.0,5.0,6 months ago
udemy_data (13).xlsx,https://www.udemy.com/course/ai-automation-build-llm-apps-ai-agents-with-n8n-apis/?couponCode=MT250929G3,ai-automation-build-llm-apps-ai-agents-with-n8n-apis,Musaf H.,Great course so far. Perfect for the no-code people! Didn't come across any coding related thing so far.,5.0,5.0,4 months ago
udemy_data (13).xlsx,https://www.udemy.com/course/ai-automation-build-llm-apps-ai-agents-with-n8n-apis/?couponCode=MT250929G3,ai-automation-build-llm-apps-ai-agents-with-n8n-apis,Juan G.,It has been a great course!!!,5.0,5.0,4 months ago
udemy_data (13).xlsx,https://www.udemy.com/course/ai-automation-build-llm-apps-ai-agents-with-n8n-apis/?couponCode=MT250929G3,ai-automation-build-llm-apps-ai-agents-with-n8n-apis,Wong Ming H.,Amazing coverage on exact what I need most for the AI Agentic workflow usage development. In deep updates and recommended.,5.0,5.0,1 month ago
udemy_data (13).xlsx,https://www.udemy.com/course/ai-automation-build-llm-apps-ai-agents-with-n8n-apis/?couponCode=MT250929G3,ai-automation-build-llm-apps-ai-agents-with-n8n-apis,Francesco D.,Excellent course. Compliment Arnie,5.0,5.0,6 months ago
udemy_data (13).xlsx,https://www.udemy.com/course/ai-automation-build-llm-apps-ai-agents-with-n8n-apis/?couponCode=MT250929G3,ai-automation-build-llm-apps-ai-agents-with-n8n-apis,Abdoul karim I.,Just start watching it and it’s way more better than all those stuff you can find on the internet. Thank you Arnold.,5.0,5.0,4 months ago
udemy_data (13).xlsx,https://www.udemy.com/course/ai-automation-build-llm-apps-ai-agents-with-n8n-apis/?couponCode=MT250929G3,ai-automation-build-llm-apps-ai-agents-with-n8n-apis,Rene S.,Well thought out so far. Clear and concise instructions and explanations.,4.0,5.0,5 months ago
udemy_data (13).xlsx,https://www.udemy.com/course/ai-automation-build-llm-apps-ai-agents-with-n8n-apis/?couponCode=MT250929G3,ai-automation-build-llm-apps-ai-agents-with-n8n-apis,Shiv Raj C.,Doing a great job so far explaining the elementary concepts. Will work well for building to the more advanced chapters,5.0,5.0,3 months ago
udemy_data (13).xlsx,https://www.udemy.com/course/ai-automation-build-llm-apps-ai-agents-with-n8n-apis/?couponCode=MT250929G3,ai-automation-build-llm-apps-ai-agents-with-n8n-apis,Tatyana S.,It’s great though I have questions and don’t know where I can ask them.,5.0,5.0,1 month ago
udemy_data (13).xlsx,https://www.udemy.com/course/ai-automation-build-llm-apps-ai-agents-with-n8n-apis/?couponCode=MT250929G3,ai-automation-build-llm-apps-ai-agents-with-n8n-apis,Asia M.,"Our instructor goes far more in depth than expected, to which this course feels like a true lecture section, giving definitions, the why and of course live testing the models.",5.0,5.0,3 months ago
udemy_data (13).xlsx,https://www.udemy.com/course/ai-automation-build-llm-apps-ai-agents-with-n8n-apis/?couponCode=MT250929G3,ai-automation-build-llm-apps-ai-agents-with-n8n-apis,Wojciech D.,Awesome stuff!,5.0,5.0,1 month ago
udemy_data (13).xlsx,https://www.udemy.com/course/ai-automation-build-llm-apps-ai-agents-with-n8n-apis/?couponCode=MT250929G3,ai-automation-build-llm-apps-ai-agents-with-n8n-apis,Francois D.,"Not fully completed the course but even this far in i have already gotten a ton of useful information out of it, Arnold is not only very knowledgeable but perhaps even more importantly can explain it very well, using practical examples to explain concepts and with good pacing and clarity. I have followed more then 40 courses on Udemy on various topics and I consider this course one of the very best that i have followed. In short highly recommend this course and @Arnold thank you very much for making it! :-)",5.0,5.0,3 months ago
udemy_data (13).xlsx,https://www.udemy.com/course/ai-automation-build-llm-apps-ai-agents-with-n8n-apis/?couponCode=MT250929G3,ai-automation-build-llm-apps-ai-agents-with-n8n-apis,Hoang P.,"Good, this is the course I find",5.0,5.0,5 months ago
udemy_data (13).xlsx,https://www.udemy.com/course/ai-automation-build-llm-apps-ai-agents-with-n8n-apis/?couponCode=MT250929G3,ai-automation-build-llm-apps-ai-agents-with-n8n-apis,Oğuz K.,Loook pretty nice still now. Very nice knowledge and clear and simply explanation.,5.0,5.0,1 week ago
udemy_data (13).xlsx,https://www.udemy.com/course/ai-automation-build-llm-apps-ai-agents-with-n8n-apis/?couponCode=MT250929G3,ai-automation-build-llm-apps-ai-agents-with-n8n-apis,Mark A S.,"So far, I'm really impressed with the course content and Arnie's presentation skills, organization, and general demeanor.",5.0,5.0,1 month ago
udemy_data (13).xlsx,https://www.udemy.com/course/ai-automation-build-llm-apps-ai-agents-with-n8n-apis/?couponCode=MT250929G3,ai-automation-build-llm-apps-ai-agents-with-n8n-apis,Aydamir G.,i dont get the point of automation at this point. Why not to write the same data in AirTable directly ?takes the same effort,2.0,5.0,2 months ago
udemy_data (13).xlsx,https://www.udemy.com/course/ai-automation-build-llm-apps-ai-agents-with-n8n-apis/?couponCode=MT250929G3,ai-automation-build-llm-apps-ai-agents-with-n8n-apis,Hans-Jörg S.,It is easy to follow the course and experiment afterwards. And it also is lots of fun.,5.0,5.0,3 months ago
udemy_data (13).xlsx,https://www.udemy.com/course/ai-automation-build-llm-apps-ai-agents-with-n8n-apis/?couponCode=MT250929G3,ai-automation-build-llm-apps-ai-agents-with-n8n-apis,Astrocell E.,The instructor has a very good understanding of the topic.,5.0,5.0,3 months ago
udemy_data (13).xlsx,https://www.udemy.com/course/ai-automation-build-llm-apps-ai-agents-with-n8n-apis/?couponCode=MT250929G3,ai-automation-build-llm-apps-ai-agents-with-n8n-apis,Almedin S.,PERFECT!!,5.0,5.0,2 weeks ago
udemy_data (13).xlsx,https://www.udemy.com/course/ai-automation-build-llm-apps-ai-agents-with-n8n-apis/?couponCode=MT250929G3,ai-automation-build-llm-apps-ai-agents-with-n8n-apis,Arjun T.,Amazing and really practical,5.0,5.0,5 months ago
udemy_data (13).xlsx,https://www.udemy.com/course/ai-automation-build-llm-apps-ai-agents-with-n8n-apis/?couponCode=MT250929G3,ai-automation-build-llm-apps-ai-agents-with-n8n-apis,Tommy R.,So far this course is great. I like how the teacher is explaining in great detail what to expect. It seems like this will be a very thorough course.,5.0,5.0,5 months ago
udemy_data (13).xlsx,https://www.udemy.com/course/ai-automation-build-llm-apps-ai-agents-with-n8n-apis/?couponCode=MT250929G3,ai-automation-build-llm-apps-ai-agents-with-n8n-apis,Roverd R.,"Wonderful course, I have a feature request for the instructor, please add lessons where you teach us how to integrate posgres to manage chat history, along with best practices.",5.0,5.0,6 months ago
udemy_data (13).xlsx,https://www.udemy.com/course/ai-automation-build-llm-apps-ai-agents-with-n8n-apis/?couponCode=MT250929G3,ai-automation-build-llm-apps-ai-agents-with-n8n-apis,Jerry T.,Gives a lot of examples,5.0,5.0,2 months ago
udemy_data (13).xlsx,https://www.udemy.com/course/ai-automation-build-llm-apps-ai-agents-with-n8n-apis/?couponCode=MT250929G3,ai-automation-build-llm-apps-ai-agents-with-n8n-apis,Craig S.,"Good so far! , but had hard time getting local installation to work on mac",4.5,5.0,1 month ago
udemy_data (13).xlsx,https://www.udemy.com/course/ai-automation-build-llm-apps-ai-agents-with-n8n-apis/?couponCode=MT250929G3,ai-automation-build-llm-apps-ai-agents-with-n8n-apis,Constantine W.,Clean step by step explanation,5.0,5.0,1 week ago
udemy_data (13).xlsx,https://www.udemy.com/course/ai-automation-build-llm-apps-ai-agents-with-n8n-apis/?couponCode=MT250929G3,ai-automation-build-llm-apps-ai-agents-with-n8n-apis,Simon,not bad,3.5,5.0,1 month ago
udemy_data (13).xlsx,https://www.udemy.com/course/ai-automation-build-llm-apps-ai-agents-with-n8n-apis/?couponCode=MT250929G3,ai-automation-build-llm-apps-ai-agents-with-n8n-apis,Kristiina R.,I am already building AI agents and this course covers the exact topics that I need. I took Arnold`s other courses and they are great. I purchased this one as soon as I got a notification to my email.,5.0,5.0,5 months ago
udemy_data (13).xlsx,https://www.udemy.com/course/ai-automation-build-llm-apps-ai-agents-with-n8n-apis/?couponCode=MT250929G3,ai-automation-build-llm-apps-ai-agents-with-n8n-apis,Maurizio B.,GREAT COURSE VERY CLEAR AND EASY TO UNDERSTAND THANK YOU!!,5.0,5.0,4 weeks ago
udemy_data (13).xlsx,https://www.udemy.com/course/ai-automation-build-llm-apps-ai-agents-with-n8n-apis/?couponCode=MT250929G3,ai-automation-build-llm-apps-ai-agents-with-n8n-apis,Sadaf R.,Excellent. So much to learn.,5.0,5.0,5 months ago
udemy_data (13).xlsx,https://www.udemy.com/course/ai-automation-build-llm-apps-ai-agents-with-n8n-apis/?couponCode=MT250929G3,ai-automation-build-llm-apps-ai-agents-with-n8n-apis,Cristian F.,"For the moment, it is not a course that's a perfect match, but also not a bad match",4.0,5.0,3 months ago
udemy_data (13).xlsx,https://www.udemy.com/course/ai-automation-build-llm-apps-ai-agents-with-n8n-apis/?couponCode=MT250929G3,ai-automation-build-llm-apps-ai-agents-with-n8n-apis,Dennis V.,Nice course. I wanted to understand the basics of n8n. Arnold explains everything clearly and in context. Thank you!,5.0,5.0,5 months ago
udemy_data (13).xlsx,https://www.udemy.com/course/ai-automation-build-llm-apps-ai-agents-with-n8n-apis/?couponCode=MT250929G3,ai-automation-build-llm-apps-ai-agents-with-n8n-apis,Peter K.,Ist ein super Kurs!!! Its a great course!,4.5,5.0,4 months ago
udemy_data (13).xlsx,https://www.udemy.com/course/ai-automation-build-llm-apps-ai-agents-with-n8n-apis/?couponCode=MT250929G3,ai-automation-build-llm-apps-ai-agents-with-n8n-apis,Wassim A.,Straight to the point,5.0,5.0,5 months ago
udemy_data (13).xlsx,https://www.udemy.com/course/ai-automation-build-llm-apps-ai-agents-with-n8n-apis/?couponCode=MT250929G3,ai-automation-build-llm-apps-ai-agents-with-n8n-apis,Dionysios K.,Great as always. Arnie has its way to share knowledge,5.0,5.0,6 months ago
udemy_data (13).xlsx,https://www.udemy.com/course/ai-automation-build-llm-apps-ai-agents-with-n8n-apis/?couponCode=MT250929G3,ai-automation-build-llm-apps-ai-agents-with-n8n-apis,Marquita E.,"So far the course is not as intimidating as I thought it would be, it's easy to understand",5.0,5.0,2 months ago
udemy_data (13).xlsx,https://www.udemy.com/course/ai-automation-build-llm-apps-ai-agents-with-n8n-apis/?couponCode=MT250929G3,ai-automation-build-llm-apps-ai-agents-with-n8n-apis,Samrat Ray C.,I am learning a lot from your course.,5.0,5.0,1 month ago
udemy_data (13).xlsx,https://www.udemy.com/course/ai-automation-build-llm-apps-ai-agents-with-n8n-apis/?couponCode=MT250929G3,ai-automation-build-llm-apps-ai-agents-with-n8n-apis,Ali S.,Brilliant. Clear explanations and good summaries. Will keep my eye open for this tutor's next courses.,5.0,5.0,1 month ago
udemy_data (13).xlsx,https://www.udemy.com/course/ai-automation-build-llm-apps-ai-agents-with-n8n-apis/?couponCode=MT250929G3,ai-automation-build-llm-apps-ai-agents-with-n8n-apis,Neel V.,Awesome course.,5.0,5.0,3 months ago
udemy_data (13).xlsx,https://www.udemy.com/course/ai-automation-build-llm-apps-ai-agents-with-n8n-apis/?couponCode=MT250929G3,ai-automation-build-llm-apps-ai-agents-with-n8n-apis,Ninetheye,Amazing course. Wider coverage,5.0,5.0,6 months ago
udemy_data (13).xlsx,https://www.udemy.com/course/ai-automation-build-llm-apps-ai-agents-with-n8n-apis/?couponCode=MT250929G3,ai-automation-build-llm-apps-ai-agents-with-n8n-apis,Dennis D.,"Sounds amazingly useful--I'm READY to GOOOOOO!!! Thanks for putting this together, Arnie!!!",5.0,5.0,4 months ago
udemy_data (13).xlsx,https://www.udemy.com/course/ai-automation-build-llm-apps-ai-agents-with-n8n-apis/?couponCode=MT250929G3,ai-automation-build-llm-apps-ai-agents-with-n8n-apis,Sergio C.,Great Course. Everything is explained in detail.,5.0,5.0,6 months ago
udemy_data (13).xlsx,https://www.udemy.com/course/ai-automation-build-llm-apps-ai-agents-with-n8n-apis/?couponCode=MT250929G3,ai-automation-build-llm-apps-ai-agents-with-n8n-apis,Daniel D.,Super Einstieg in das Thema.,5.0,5.0,2 months ago
udemy_data (13).xlsx,https://www.udemy.com/course/ai-automation-build-llm-apps-ai-agents-with-n8n-apis/?couponCode=MT250929G3,ai-automation-build-llm-apps-ai-agents-with-n8n-apis,Christian,Me encanta muy bueno,5.0,5.0,5 months ago
udemy_data (13).xlsx,https://www.udemy.com/course/ai-automation-build-llm-apps-ai-agents-with-n8n-apis/?couponCode=MT250929G3,ai-automation-build-llm-apps-ai-agents-with-n8n-apis,A G.,AI Automation has been made very structured and goes step by step. I love the way he teaches it very orderly and accurate.,5.0,5.0,6 months ago
udemy_data (13).xlsx,https://www.udemy.com/course/ai-automation-build-llm-apps-ai-agents-with-n8n-apis/?couponCode=MT250929G3,ai-automation-build-llm-apps-ai-agents-with-n8n-apis,Krishna K.,"it covers all basics of AI and agents, so far it looks good.",4.0,5.0,2 months ago
udemy_data (13).xlsx,https://www.udemy.com/course/ai-automation-build-llm-apps-ai-agents-with-n8n-apis/?couponCode=MT250929G3,ai-automation-build-llm-apps-ai-agents-with-n8n-apis,Juan Daniel P.,Good election of contents. Buena chamo...,4.5,5.0,4 months ago
