source_file,course_url,course_slug,reviewer_name,review_text,rating_value,rating_scale,review_time_relative
udemy_data (13).xlsx,https://www.udemy.com/course/ai-automation-build-llm-apps-ai-agents-with-n8n-apis/?couponCode=MT250929G3,ai-automation-build-llm-apps-ai-agents-with-n8n-apis,Kalana M.,Detailed explanations in most parts. Enjoyed!,5.0,5.0,2 months ago
udemy_data (13).xlsx,https://www.udemy.com/course/ai-automation-build-llm-apps-ai-agents-with-n8n-apis/?couponCode=MT250929G3,ai-automation-build-llm-apps-ai-agents-with-n8n-apis,Jim M.,"I am learning so much more with deep understanding than anything I came across on YouTube. Arnie is a great teacher and I like how he focuses on n8n and all the ways to use the platform. He makes it very understandable at a core, foundational level, which allows you to easily see in your mind all of the possibilities of AI agents. Outstanding course!",5.0,5.0,3 months ago
udemy_data (13).xlsx,https://www.udemy.com/course/ai-automation-build-llm-apps-ai-agents-with-n8n-apis/?couponCode=MT250929G3,ai-automation-build-llm-apps-ai-agents-with-n8n-apis,Matthew M.,Great insight. I'm realy enjoying the lectures. learning a lot of exciting techniques!,5.0,5.0,2 months ago
udemy_data (13).xlsx,https://www.udemy.com/course/ai-automation-build-llm-apps-ai-agents-with-n8n-apis/?couponCode=MT250929G3,ai-automation-build-llm-apps-ai-agents-with-n8n-apis,Regragui,excellent cours pour l'instant,5.0,5.0,1 month ago
udemy_data (13).xlsx,https://www.udemy.com/course/ai-automation-build-llm-apps-ai-agents-with-n8n-apis/?couponCode=MT250929G3,ai-automation-build-llm-apps-ai-agents-with-n8n-apis,Sean Bien B.,great course but some sections might need some update,4.5,5.0,2 weeks ago
udemy_data (13).xlsx,https://www.udemy.com/course/ai-automation-build-llm-apps-ai-agents-with-n8n-apis/?couponCode=MT250929G3,ai-automation-build-llm-apps-ai-agents-with-n8n-apis,Lorenzo D.,"Arnie is great, very helpful so far. I have been developing for 6 years now, and haven't dived into automation yet, but the customizing with n8n is very powerful and I am excited to see where this will take me.",5.0,5.0,4 months ago
udemy_data (13).xlsx,https://www.udemy.com/course/ai-automation-build-llm-apps-ai-agents-with-n8n-apis/?couponCode=MT250929G3,ai-automation-build-llm-apps-ai-agents-with-n8n-apis,Josh P.,I love Arnie's course. His explanations are thorough and the repetition of information through each lesson helps solidify the learning.,5.0,5.0,5 months ago
udemy_data (13).xlsx,https://www.udemy.com/course/ai-automation-build-llm-apps-ai-agents-with-n8n-apis/?couponCode=MT250929G3,ai-automation-build-llm-apps-ai-agents-with-n8n-apis,Udemy User,"too condensed with information , but little bit quick in explaining them",4.5,5.0,4 months ago
udemy_data (13).xlsx,https://www.udemy.com/course/ai-automation-build-llm-apps-ai-agents-with-n8n-apis/?couponCode=MT250929G3,ai-automation-build-llm-apps-ai-agents-with-n8n-apis,Motty C.,Very informative and concise. Love the rhythm and the just-right balance between material covered and simplicity,5.0,5.0,3 months ago
udemy_data (13).xlsx,https://www.udemy.com/course/ai-automation-build-llm-apps-ai-agents-with-n8n-apis/?couponCode=MT250929G3,ai-automation-build-llm-apps-ai-agents-with-n8n-apis,Michele M.,"I think Arnie has created an amazing program. It's like Meccano for AI Agent builders. He is a real star that has no fuss or frills. Straight to the point. Content is exactly what you need. To any would be builders, take this course and start dreaming!!!",5.0,5.0,5 months ago
udemy_data (13).xlsx,https://www.udemy.com/course/ai-automation-build-llm-apps-ai-agents-with-n8n-apis/?couponCode=MT250929G3,ai-automation-build-llm-apps-ai-agents-with-n8n-apis,Hasan M.,Yes content is clean and really good,5.0,5.0,1 month ago
udemy_data (13).xlsx,https://www.udemy.com/course/ai-automation-build-llm-apps-ai-agents-with-n8n-apis/?couponCode=MT250929G3,ai-automation-build-llm-apps-ai-agents-with-n8n-apis,Theodore E.,So awful. A lot of details left this is more like a tutorial not a course. Not enough explanation and the instructor is also very messy not organized. I don't recommend this course.,1.0,5.0,3 months ago
udemy_data (13).xlsx,https://www.udemy.com/course/ai-automation-build-llm-apps-ai-agents-with-n8n-apis/?couponCode=MT250929G3,ai-automation-build-llm-apps-ai-agents-with-n8n-apis,Jack S.,Incredible course taking me into the future of AI one lesson at a time.,5.0,5.0,3 months ago
udemy_data (13).xlsx,https://www.udemy.com/course/ai-automation-build-llm-apps-ai-agents-with-n8n-apis/?couponCode=MT250929G3,ai-automation-build-llm-apps-ai-agents-with-n8n-apis,Leonardo L.,Still at the middle but i already feel this will be one of the best course at the Udemy i have ever watched.,5.0,5.0,2 months ago
udemy_data (13).xlsx,https://www.udemy.com/course/ai-automation-build-llm-apps-ai-agents-with-n8n-apis/?couponCode=MT250929G3,ai-automation-build-llm-apps-ai-agents-with-n8n-apis,Marco B.,"Enlightening, practical, and well-suited for beginners. Arnold is a great teacher.",5.0,5.0,4 months ago
udemy_data (13).xlsx,https://www.udemy.com/course/ai-automation-build-llm-apps-ai-agents-with-n8n-apis/?couponCode=MT250929G3,ai-automation-build-llm-apps-ai-agents-with-n8n-apis,Ignas L.,Needs to be updated ASAP!!! I am giving this course 1 star. It is a great course and i like the instructor but i dont see any help from instructor in Q/A section- that at least he could do because half of projects dont work without finding solution myself.,1.5,5.0,3 months ago
udemy_data (13).xlsx,https://www.udemy.com/course/ai-automation-build-llm-apps-ai-agents-with-n8n-apis/?couponCode=MT250929G3,ai-automation-build-llm-apps-ai-agents-with-n8n-apis,Gai R.,"Amazing man, Just amazing. Still starting in intro but looking good so far.",5.0,5.0,3 months ago
udemy_data (13).xlsx,https://www.udemy.com/course/ai-automation-build-llm-apps-ai-agents-with-n8n-apis/?couponCode=MT250929G3,ai-automation-build-llm-apps-ai-agents-with-n8n-apis,Nico N.,"I am a 100% complete beginner with 0 knowledge and this course is very digestible. A few hours in and it seems to be a ''copy/paste me'' type of teaching, and if you don't like that type (I don't), keep going, things comes clearer as you go deeper in the lessons. Excellent course. The RAG and the scrapping part was awesome. Thanks Arnie",5.0,5.0,6 months ago
udemy_data (13).xlsx,https://www.udemy.com/course/ai-automation-build-llm-apps-ai-agents-with-n8n-apis/?couponCode=MT250929G3,ai-automation-build-llm-apps-ai-agents-with-n8n-apis,Hans D.,"Deze persoon legt het geweldig uit, top de rust en vertrouwen super",4.5,5.0,2 months ago
udemy_data (13).xlsx,https://www.udemy.com/course/ai-automation-build-llm-apps-ai-agents-with-n8n-apis/?couponCode=MT250929G3,ai-automation-build-llm-apps-ai-agents-with-n8n-apis,Shubham G.,Content seems great so far! Its total transforming the ideas into action,5.0,5.0,3 months ago
udemy_data (13).xlsx,https://www.udemy.com/course/ai-automation-build-llm-apps-ai-agents-with-n8n-apis/?couponCode=MT250929G3,ai-automation-build-llm-apps-ai-agents-with-n8n-apis,Jonas Stapper,This is a great course for beginners to get their feet wet and build their first few AI agents. The instructor is really patient and shows everything multiple times and strikes an excellent balance between necessary theory and many practical examples and use cases.,5.0,5.0,4 months ago
udemy_data (13).xlsx,https://www.udemy.com/course/ai-automation-build-llm-apps-ai-agents-with-n8n-apis/?couponCode=MT250929G3,ai-automation-build-llm-apps-ai-agents-with-n8n-apis,Waheeda D.,Arnold covered it very well! Thank you!,5.0,5.0,2 months ago
udemy_data (13).xlsx,https://www.udemy.com/course/ai-automation-build-llm-apps-ai-agents-with-n8n-apis/?couponCode=MT250929G3,ai-automation-build-llm-apps-ai-agents-with-n8n-apis,Daniela B.,"Great course, I learned a lot. Thank you!",5.0,5.0,2 months ago
udemy_data (13).xlsx,https://www.udemy.com/course/ai-automation-build-llm-apps-ai-agents-with-n8n-apis/?couponCode=MT250929G3,ai-automation-build-llm-apps-ai-agents-with-n8n-apis,Joshua L.,"It is a good course for AI agents, not really for beginners",5.0,5.0,4 months ago
udemy_data (13).xlsx,https://www.udemy.com/course/ai-automation-build-llm-apps-ai-agents-with-n8n-apis/?couponCode=MT250929G3,ai-automation-build-llm-apps-ai-agents-with-n8n-apis,Luis Antonio Olivares M.,I've learned so much so quickly!,5.0,5.0,1 month ago
udemy_data (13).xlsx,https://www.udemy.com/course/ai-automation-build-llm-apps-ai-agents-with-n8n-apis/?couponCode=MT250929G3,ai-automation-build-llm-apps-ai-agents-with-n8n-apis,Plamen P.,"This course exceeded my expectations. Well done, Arnie!",5.0,5.0,3 months ago
udemy_data (13).xlsx,https://www.udemy.com/course/ai-automation-build-llm-apps-ai-agents-with-n8n-apis/?couponCode=MT250929G3,ai-automation-build-llm-apps-ai-agents-with-n8n-apis,Wilson de Sousa S.,Estou agora com 75% por cento do curso completo e posso dizer que valeu a pena. Recomendo!,5.0,5.0,4 months ago
udemy_data (13).xlsx,https://www.udemy.com/course/ai-automation-build-llm-apps-ai-agents-with-n8n-apis/?couponCode=MT250929G3,ai-automation-build-llm-apps-ai-agents-with-n8n-apis,Robert M.,"Excelent course! Thank you so much for comprehensive information, step by step instructions and many more. Pity you have your youtube channel in Deutsch :) I recommend to change it!",5.0,5.0,6 months ago
udemy_data (13).xlsx,https://www.udemy.com/course/ai-automation-build-llm-apps-ai-agents-with-n8n-apis/?couponCode=MT250929G3,ai-automation-build-llm-apps-ai-agents-with-n8n-apis,Amit B.,"Learned many things about AI, LLM, N8n and integrations.",5.0,5.0,3 months ago
udemy_data (13).xlsx,https://www.udemy.com/course/ai-automation-build-llm-apps-ai-agents-with-n8n-apis/?couponCode=MT250929G3,ai-automation-build-llm-apps-ai-agents-with-n8n-apis,Panam M.,Some of the node components like the Question and Answer nodes are not available in the n8n version i tried. Not sure what to use.,4.0,5.0,5 months ago
udemy_data (13).xlsx,https://www.udemy.com/course/ai-automation-build-llm-apps-ai-agents-with-n8n-apis/?couponCode=MT250929G3,ai-automation-build-llm-apps-ai-agents-with-n8n-apis,C.P. Néstor Santiago F.,"muy buen curso, bien completo",5.0,5.0,3 months ago
udemy_data (13).xlsx,https://www.udemy.com/course/ai-automation-build-llm-apps-ai-agents-with-n8n-apis/?couponCode=MT250929G3,ai-automation-build-llm-apps-ai-agents-with-n8n-apis,Dipayan P.,Concise and to the point explanation till now. Let's hope this trend continues in the later lectures too.,4.5,5.0,4 months ago
udemy_data (13).xlsx,https://www.udemy.com/course/ai-automation-build-llm-apps-ai-agents-with-n8n-apis/?couponCode=MT250929G3,ai-automation-build-llm-apps-ai-agents-with-n8n-apis,Mark Isling S.,"Really good at explaining both simple and complicated stuff. He goes from a-z without missing a step, making sure that there is no confusion in what you learn.",5.0,5.0,2 months ago
udemy_data (13).xlsx,https://www.udemy.com/course/ai-automation-build-llm-apps-ai-agents-with-n8n-apis/?couponCode=MT250929G3,ai-automation-build-llm-apps-ai-agents-with-n8n-apis,Nikolay P.,"The course looks great! I would like to suggest including MCPs though, is there a chance for this to happen?",5.0,5.0,4 months ago
udemy_data (13).xlsx,https://www.udemy.com/course/ai-automation-build-llm-apps-ai-agents-with-n8n-apis/?couponCode=MT250929G3,ai-automation-build-llm-apps-ai-agents-with-n8n-apis,Agustin G.,"I love this course so far. A more practical approach starting from section 3, which is nice. I'm learning a lot, can't wait to keep moving forward",5.0,5.0,5 months ago
udemy_data (13).xlsx,https://www.udemy.com/course/ai-automation-build-llm-apps-ai-agents-with-n8n-apis/?couponCode=MT250929G3,ai-automation-build-llm-apps-ai-agents-with-n8n-apis,Trinity A.,"Very easy to understand, and very educational",5.0,5.0,2 months ago
udemy_data (13).xlsx,https://www.udemy.com/course/ai-automation-build-llm-apps-ai-agents-with-n8n-apis/?couponCode=MT250929G3,ai-automation-build-llm-apps-ai-agents-with-n8n-apis,John W.,Great course with lots of breath and depth in AI topics. Just what i needed to get up to speed! I'm halfway through the course and already learned so much. Highly recommended!,5.0,5.0,5 months ago
udemy_data (13).xlsx,https://www.udemy.com/course/ai-automation-build-llm-apps-ai-agents-with-n8n-apis/?couponCode=MT250929G3,ai-automation-build-llm-apps-ai-agents-with-n8n-apis,Gary W.,Very good course enjoying it very much,4.5,5.0,3 months ago
udemy_data (13).xlsx,https://www.udemy.com/course/ai-automation-build-llm-apps-ai-agents-with-n8n-apis/?couponCode=MT250929G3,ai-automation-build-llm-apps-ai-agents-with-n8n-apis,Bryan N.,Great course so far! I've learned a lot. Maybe adding more explanation on JSON for the begginers would be fine.,5.0,5.0,5 months ago
udemy_data (13).xlsx,https://www.udemy.com/course/ai-automation-build-llm-apps-ai-agents-with-n8n-apis/?couponCode=MT250929G3,ai-automation-build-llm-apps-ai-agents-with-n8n-apis,Trevor J.,"I like the clear and concise goals that have been set, as well as the detailed walk-through of what to expect!",5.0,5.0,4 months ago
udemy_data (13).xlsx,https://www.udemy.com/course/ai-automation-build-llm-apps-ai-agents-with-n8n-apis/?couponCode=MT250929G3,ai-automation-build-llm-apps-ai-agents-with-n8n-apis,Fernando P.,"Teacher should not have his websites in German as it becomes very confusing to follow, the class is in English so text should be in English. Other than that, everything is good so far.",4.0,5.0,1 month ago
udemy_data (13).xlsx,https://www.udemy.com/course/ai-automation-build-llm-apps-ai-agents-with-n8n-apis/?couponCode=MT250929G3,ai-automation-build-llm-apps-ai-agents-with-n8n-apis,Udemy User,75% of the course is just setting up accounts for different platforms,3.0,5.0,2 months ago
udemy_data (13).xlsx,https://www.udemy.com/course/ai-automation-build-llm-apps-ai-agents-with-n8n-apis/?couponCode=MT250929G3,ai-automation-build-llm-apps-ai-agents-with-n8n-apis,Jurand G.,Really good course! So much knowledge blows my mind ;) Now I just need to play around with all those tools to squeeze as much as possible from them.,5.0,5.0,5 months ago
udemy_data (13).xlsx,https://www.udemy.com/course/ai-automation-build-llm-apps-ai-agents-with-n8n-apis/?couponCode=MT250929G3,ai-automation-build-llm-apps-ai-agents-with-n8n-apis,Paul G.,"Great course, I Learned a lot, thanks for your efforts.",5.0,5.0,4 months ago
udemy_data (13).xlsx,https://www.udemy.com/course/ai-automation-build-llm-apps-ai-agents-with-n8n-apis/?couponCode=MT250929G3,ai-automation-build-llm-apps-ai-agents-with-n8n-apis,Pranay I.,So far everything is right on point.,5.0,5.0,2 months ago
udemy_data (13).xlsx,https://www.udemy.com/course/ai-automation-build-llm-apps-ai-agents-with-n8n-apis/?couponCode=MT250929G3,ai-automation-build-llm-apps-ai-agents-with-n8n-apis,Iclesemar Claudino Z.,Esperava algo mais didático por se tratar de um conteúdo básico.,3.0,5.0,1 month ago
udemy_data (13).xlsx,https://www.udemy.com/course/ai-automation-build-llm-apps-ai-agents-with-n8n-apis/?couponCode=MT250929G3,ai-automation-build-llm-apps-ai-agents-with-n8n-apis,Samir C.,Great content and form to present!,5.0,5.0,1 month ago
udemy_data (13).xlsx,https://www.udemy.com/course/ai-automation-build-llm-apps-ai-agents-with-n8n-apis/?couponCode=MT250929G3,ai-automation-build-llm-apps-ai-agents-with-n8n-apis,Sven B.,Danke dir. Wirklich sehr gelungene Einführung in das Thema n8n und LLM.,5.0,5.0,2 months ago
udemy_data (13).xlsx,https://www.udemy.com/course/ai-automation-build-llm-apps-ai-agents-with-n8n-apis/?couponCode=MT250929G3,ai-automation-build-llm-apps-ai-agents-with-n8n-apis,Sefuo Foku L.,I will appreciate queries or concerns being responded to within 24 hours at most. My complains were not getting responses soon enough. Created loads of delays,5.0,5.0,6 months ago
udemy_data (13).xlsx,https://www.udemy.com/course/ai-automation-build-llm-apps-ai-agents-with-n8n-apis/?couponCode=MT250929G3,ai-automation-build-llm-apps-ai-agents-with-n8n-apis,Els P.,I believe this is a good match since I have no experience with AI automation and AI agents. This course provides me with basic knowledge of AI technology.,4.5,5.0,1 month ago
udemy_data (13).xlsx,https://www.udemy.com/course/ai-automation-build-llm-apps-ai-agents-with-n8n-apis/?couponCode=MT250929G3,ai-automation-build-llm-apps-ai-agents-with-n8n-apis,Vivek P.,A good course for beginners and lots of learning,4.5,5.0,1 month ago
udemy_data (13).xlsx,https://www.udemy.com/course/ai-automation-build-llm-apps-ai-agents-with-n8n-apis/?couponCode=MT250929G3,ai-automation-build-llm-apps-ai-agents-with-n8n-apis,Robert R.,The information about Test Time Computing was very informative and interesting.,4.0,5.0,4 months ago
udemy_data (13).xlsx,https://www.udemy.com/course/ai-automation-build-llm-apps-ai-agents-with-n8n-apis/?couponCode=MT250929G3,ai-automation-build-llm-apps-ai-agents-with-n8n-apis,Mohammed T.,The looks like an amazing course I checked most courses in udemy about n8n this is the best hands down. If you want to learn then you really should take this course the content is amazing,5.0,5.0,6 months ago
udemy_data (13).xlsx,https://www.udemy.com/course/ai-automation-build-llm-apps-ai-agents-with-n8n-apis/?couponCode=MT250929G3,ai-automation-build-llm-apps-ai-agents-with-n8n-apis,Samten S.,"his accent is too strong and most of his text are in German, cant follow through properly",1.5,5.0,1 month ago
udemy_data (13).xlsx,https://www.udemy.com/course/ai-automation-build-llm-apps-ai-agents-with-n8n-apis/?couponCode=MT250929G3,ai-automation-build-llm-apps-ai-agents-with-n8n-apis,Milad H.,"Dry and monotonous, the instructor repeats some points many times over. isn't what I expected from the course",1.0,5.0,3 weeks ago
udemy_data (13).xlsx,https://www.udemy.com/course/ai-automation-build-llm-apps-ai-agents-with-n8n-apis/?couponCode=MT250929G3,ai-automation-build-llm-apps-ai-agents-with-n8n-apis,Gytis Z.,"it , ok, but i didn't found what i been looking for.",4.0,5.0,3 months ago
udemy_data (13).xlsx,https://www.udemy.com/course/ai-automation-build-llm-apps-ai-agents-with-n8n-apis/?couponCode=MT250929G3,ai-automation-build-llm-apps-ai-agents-with-n8n-apis,Felipe M.,"Excelente course, with to much material",5.0,5.0,3 months ago
udemy_data (13).xlsx,https://www.udemy.com/course/ai-automation-build-llm-apps-ai-agents-with-n8n-apis/?couponCode=MT250929G3,ai-automation-build-llm-apps-ai-agents-with-n8n-apis,Bernadus Z.,"still nice , however i got problem when try connect with whastapp",5.0,5.0,3 months ago
udemy_data (13).xlsx,https://www.udemy.com/course/ai-automation-build-llm-apps-ai-agents-with-n8n-apis/?couponCode=MT250929G3,ai-automation-build-llm-apps-ai-agents-with-n8n-apis,ragothaman S.,Very nice explanation with examples just one word wowwww!,4.5,5.0,2 months ago
udemy_data (13).xlsx,https://www.udemy.com/course/ai-automation-build-llm-apps-ai-agents-with-n8n-apis/?couponCode=MT250929G3,ai-automation-build-llm-apps-ai-agents-with-n8n-apis,Jeff,"Excellent course, very informative and the hands on pieces were great.",5.0,5.0,4 months ago
udemy_data (13).xlsx,https://www.udemy.com/course/ai-automation-build-llm-apps-ai-agents-with-n8n-apis/?couponCode=MT250929G3,ai-automation-build-llm-apps-ai-agents-with-n8n-apis,Penny W.,"some of videos are out of date. Also, Those videos are not mac compatible.",3.0,5.0,2 weeks ago
udemy_data (13).xlsx,https://www.udemy.com/course/ai-automation-build-llm-apps-ai-agents-with-n8n-apis/?couponCode=MT250929G3,ai-automation-build-llm-apps-ai-agents-with-n8n-apis,Thandeka S.,"its perfect, Arnie is an awesome instructor",5.0,5.0,1 month ago
udemy_data (13).xlsx,https://www.udemy.com/course/ai-automation-build-llm-apps-ai-agents-with-n8n-apis/?couponCode=MT250929G3,ai-automation-build-llm-apps-ai-agents-with-n8n-apis,Lateef M.,This dude goes above and beyond. It's the complete idiot's guide to building Automations and AI/Agent automations-- but not totally dumbed down in a way that causes learning fatigue. It's fast and crisp [I use 1.75x speed as he recommended] and totally no BS. He's honest. Tells you what works and what doesn't. He gives off the vibe that he's legit and totally wants to help you. He's geek enough to get down to brass tacks on specific things but also goal oriented so you don't stray too long from the primary task. Thank you Arnie.,5.0,5.0,1 month ago
udemy_data (13).xlsx,https://www.udemy.com/course/ai-automation-build-llm-apps-ai-agents-with-n8n-apis/?couponCode=MT250929G3,ai-automation-build-llm-apps-ai-agents-with-n8n-apis,Ingila E.,The best teacher I had!,5.0,5.0,1 month ago
udemy_data (13).xlsx,https://www.udemy.com/course/ai-automation-build-llm-apps-ai-agents-with-n8n-apis/?couponCode=MT250929G3,ai-automation-build-llm-apps-ai-agents-with-n8n-apis,Nikhil S.,your explanation are so clear so as a Non technical individual i find it easy to grasp each and everything,5.0,5.0,1 month ago
udemy_data (13).xlsx,https://www.udemy.com/course/ai-automation-build-llm-apps-ai-agents-with-n8n-apis/?couponCode=MT250929G3,ai-automation-build-llm-apps-ai-agents-with-n8n-apis,Tomas K.,"Ran into a problem. I tried everything to solve it, but I couldn't get any help. The AI answer bot is garbage. The downside of courses on Udemy is that there's no community to get answers to your questions. Because I'm stuck in the course, I can continue. I asked for a refund, but I was dismissed because I had watched too much of the course.",1.0,5.0,3 weeks ago
udemy_data (13).xlsx,https://www.udemy.com/course/ai-automation-build-llm-apps-ai-agents-with-n8n-apis/?couponCode=MT250929G3,ai-automation-build-llm-apps-ai-agents-with-n8n-apis,Cheryl D H.,Its great visuals !!!!!!!!!!!!!,5.0,5.0,3 months ago
udemy_data (13).xlsx,https://www.udemy.com/course/ai-automation-build-llm-apps-ai-agents-with-n8n-apis/?couponCode=MT250929G3,ai-automation-build-llm-apps-ai-agents-with-n8n-apis,Esau C.,It's has been so useful and really practical without much theory,5.0,5.0,1 month ago
udemy_data (13).xlsx,https://www.udemy.com/course/ai-automation-build-llm-apps-ai-agents-with-n8n-apis/?couponCode=MT250929G3,ai-automation-build-llm-apps-ai-agents-with-n8n-apis,Armin B.,"One gets the pleasant impression that the author is a person that makes things happen and that he's able to teach you this art. His style is direct and he tells you straightforward, what he thinks will be helpful for you and what you better forget. I've just at the beginning of this course but author and course program are very promising for me. A big ""Donk schean"" to Arnie.",5.0,5.0,2 months ago
udemy_data (13).xlsx,https://www.udemy.com/course/ai-automation-build-llm-apps-ai-agents-with-n8n-apis/?couponCode=MT250929G3,ai-automation-build-llm-apps-ai-agents-with-n8n-apis,Aron G. K.,"Very good course and content, my only gripe is that the instructor does things very very fast and i have to keep pausing in order to do things at the same time and not stay behind. Also most of the prompts of the first half at least should be available in some downloadable file so that we can just copy them into the expression fields on n8n",5.0,5.0,5 months ago
udemy_data (13).xlsx,https://www.udemy.com/course/ai-automation-build-llm-apps-ai-agents-with-n8n-apis/?couponCode=MT250929G3,ai-automation-build-llm-apps-ai-agents-with-n8n-apis,Mehmet Cenk T.,"Still working on the tutorials and not just following them up, I already introduced new processes to my daily workflows.",5.0,5.0,5 months ago
udemy_data (13).xlsx,https://www.udemy.com/course/ai-automation-build-llm-apps-ai-agents-with-n8n-apis/?couponCode=MT250929G3,ai-automation-build-llm-apps-ai-agents-with-n8n-apis,Haile K.,This is the best course that I have ever encountered thank you arnie on my journey to learning AI agents and aoutomations,5.0,5.0,5 months ago
udemy_data (13).xlsx,https://www.udemy.com/course/ai-automation-build-llm-apps-ai-agents-with-n8n-apis/?couponCode=MT250929G3,ai-automation-build-llm-apps-ai-agents-with-n8n-apis,Mia Aneth M.,It's still early on the learning process but having such overview of what to expect to learn is indeed something exciting to look forward to.,5.0,5.0,5 months ago
udemy_data (13).xlsx,https://www.udemy.com/course/ai-automation-build-llm-apps-ai-agents-with-n8n-apis/?couponCode=MT250929G3,ai-automation-build-llm-apps-ai-agents-with-n8n-apis,Tato P.,great introductory course! sets the basis to start working with complex N8N flows!,5.0,5.0,5 months ago
udemy_data (13).xlsx,https://www.udemy.com/course/ai-automation-build-llm-apps-ai-agents-with-n8n-apis/?couponCode=MT250929G3,ai-automation-build-llm-apps-ai-agents-with-n8n-apis,Nitin D.,"It's a very descriptive course. Each and every important information related to AI automation using n8n is very well explained. Kudos to the educator.. I really appreciate your efforts...it takes a lot of cuts, retakes and edits to cover every little detail in a video. And you did it for the entire course..🙏🏻🙏🏻 Respect for you...Thank you for providing such level of information to us.",5.0,5.0,3 months ago
udemy_data (13).xlsx,https://www.udemy.com/course/ai-automation-build-llm-apps-ai-agents-with-n8n-apis/?couponCode=MT250929G3,ai-automation-build-llm-apps-ai-agents-with-n8n-apis,Jean Luc T.,"No support (question posted since months, no explanation, just a collection of workflows. Some of them work, others don't.",2.5,5.0,4 months ago
udemy_data (13).xlsx,https://www.udemy.com/course/ai-automation-build-llm-apps-ai-agents-with-n8n-apis/?couponCode=MT250929G3,ai-automation-build-llm-apps-ai-agents-with-n8n-apis,Family T.,Thank you for telling us to 2x speed....it really helped me get into flow.,5.0,5.0,5 months ago
