source_file,course_url,course_slug,reviewer_name,review_text,rating_value,rating_scale,review_time_relative
udemy_data (14).xlsx,https://www.udemy.com/course/n8n-course/?couponCode=MT250929G3,n8n-course,Steve,Fantastic course. Everything you need to know about N8N is practically here. Definitely helped me a lot,4.0,5.0,1 week ago
udemy_data (14).xlsx,https://www.udemy.com/course/n8n-course/?couponCode=MT250929G3,n8n-course,Hemant J.,"The number of usecases covered for n8n are amazing! Not going to go through all of them right now, but I want to use them for reference over the coming months and years.",5.0,5.0,1 month ago
udemy_data (14).xlsx,https://www.udemy.com/course/n8n-course/?couponCode=MT250929G3,n8n-course,Sally A.,"This course was above the money value, so well explained and so loaded, The lecturers have a great passion lecturing and always updating with new information. In short you guys are the best ! Best course so far on learning on AI agent and automation.",5.0,5.0,2 months ago
udemy_data (14).xlsx,https://www.udemy.com/course/n8n-course/?couponCode=MT250929G3,n8n-course,Nestor F P.,"Let me give you give you guys a 5 million of stars, I'm Industrial Engineer and I love Process Automation, including AI and specially N8N has helped me a LOT, though when I went to school I hated Programming and coding classes with all my soul. You guys made this course wonderful, easy to explain, understandable, the exams I was able to pass them in the first try (I always fail because I lack of attention if the course is boring), exceptionally good this course. Bad *ss job.",5.0,5.0,3 months ago
udemy_data (14).xlsx,https://www.udemy.com/course/n8n-course/?couponCode=MT250929G3,n8n-course,Fernando P.,"The course is very good, however, i struggle a lot when Krystian is teaching, he constantly skips steps and assumes you know things we obviously do not. Damian is excellent, even if he already taught you before, he will always remind you how to do things, and explains very good.",4.5,5.0,1 month ago
udemy_data (14).xlsx,https://www.udemy.com/course/n8n-course/?couponCode=MT250929G3,n8n-course,Filip D.,"I am very disappointed with this course. The basic concepts are not explained at all, and the user has to look them up in the help section. The workflows use various unofficial APIs that produce useless content for social networks. Nothing solid here — just a waste of money.",1.0,5.0,1 week ago
udemy_data (14).xlsx,https://www.udemy.com/course/n8n-course/?couponCode=MT250929G3,n8n-course,Colleen K.,This course was very comprehensive related to AI Agents and Workflows that are possible in n8n,4.0,5.0,2 months ago
udemy_data (14).xlsx,https://www.udemy.com/course/n8n-course/?couponCode=MT250929G3,n8n-course,Beni K.,"I enjoyed this n8n course and found it quite useful. It had many practical examples, and the source files were provided, which made it easier to practice and understand.",3.5,5.0,1 month ago
udemy_data (14).xlsx,https://www.udemy.com/course/n8n-course/?couponCode=MT250929G3,n8n-course,Anas Z.,"I loved this course as I had no idea of what n8n is, let alone automations, but a big thank you to the creators of this course, now I am pretty confident in using the n8n environment, creating workflows, and making AI agents. What I would love to suggest is that if you guys could add a small section or just one video regarding how to migrate your workflows from Zapier and make.com, that would be super helpful and 100% complete the criteria of this course, which is understanding n8n",4.5,5.0,1 month ago
udemy_data (14).xlsx,https://www.udemy.com/course/n8n-course/?couponCode=MT250929G3,n8n-course,Katarzyna,"This is a great course, very comprehensive. I'm not a beginner in n8n but still I've learnt lots of valuable things.",5.0,5.0,3 weeks ago
udemy_data (14).xlsx,https://www.udemy.com/course/n8n-course/?couponCode=MT250929G3,n8n-course,Leandro Mesquita D.,Excelente conteúdo. Os exemplos tornam o material didático e prático!,5.0,5.0,2 months ago
udemy_data (14).xlsx,https://www.udemy.com/course/n8n-course/?couponCode=MT250929G3,n8n-course,Sagi L.,"I enjoyed the course a lot It was very beneficial as for what the name of the course say - AI built in to N8N (this mean some basic understanding of building simpler workflows in n8n must be achieved - it is explained in the first parts of the course but I strongly recommend more practice,",5.0,5.0,4 months ago
udemy_data (14).xlsx,https://www.udemy.com/course/n8n-course/?couponCode=MT250929G3,n8n-course,Oscar S.,"I love this handson approach! Well done, very helpful course!",5.0,5.0,4 months ago
udemy_data (14).xlsx,https://www.udemy.com/course/n8n-course/?couponCode=MT250929G3,n8n-course,Mauricio M.,"I really enjoyed this course on n8n, automation, and AI agents. It’s highly detailed and very hands-on, which I really appreciate. The explanations are clear and easy to follow, making even complex topics feel approachable. One of the highlights for me was the huge number of templates included—an incredible resource that saves a ton of time. You can easily adapt them to fit your clients' needs. Overall, an excellent course for anyone serious about implementing automation with real-world applications.",4.5,5.0,4 months ago
udemy_data (14).xlsx,https://www.udemy.com/course/n8n-course/?couponCode=MT250929G3,n8n-course,Howard S.,"I went through a first pass on this course to get an idea of what n8n can do. I was amazed at what n8n can do. This course gave many ideas on how to use n8n as well as how to get workflows already in the community. This course presented many ideas that can make a 7 figure income. Even if you just implemented one of the ideas in this course, you can get to financial independence. There are several ideas offered and step by step how to implement them. Don't get over whelmed, just pick one idea and use it well. You can alway go back and do another idea later.",5.0,5.0,4 months ago
udemy_data (14).xlsx,https://www.udemy.com/course/n8n-course/?couponCode=MT250929G3,n8n-course,Shaïna C.,"Thank you for the course, very helpful !",5.0,5.0,4 months ago
udemy_data (14).xlsx,https://www.udemy.com/course/n8n-course/?couponCode=MT250929G3,n8n-course,Chady N.,"I changed the review twice because I didn't know what I didn't know. But here is the catch, if you're a complete beginner go with n8n official platform, start with the free trial and then decide for yourself if it is worth your money later. DO NOT go with Hostinger unless you have some IT knowledge, because you're gonna spend the most of your time repairing api that breaks, and when updating n8n on Hostinger all of my credentials changed and spent 75% of my time trying to fix it.",5.0,5.0,1 month ago
udemy_data (14).xlsx,https://www.udemy.com/course/n8n-course/?couponCode=MT250929G3,n8n-course,Josue Reinaldo P.,el curso debe estar en español.,5.0,5.0,2 months ago
udemy_data (14).xlsx,https://www.udemy.com/course/n8n-course/?couponCode=MT250929G3,n8n-course,Geo J.,This course taught me new lesson regarding ai voice agents and youtube video generations based on n8n and i am truly gratefull,4.0,5.0,4 months ago
udemy_data (14).xlsx,https://www.udemy.com/course/n8n-course/?couponCode=MT250929G3,n8n-course,Kees T.,"There is a lot of content, so it is a good course to get a first introduction with N8N. There is a lot of content around workflows to create workflows around ai video or automate mail workflows. So if that's what you're looking for this is a good course.",3.0,5.0,2 months ago
udemy_data (14).xlsx,https://www.udemy.com/course/n8n-course/?couponCode=MT250929G3,n8n-course,Panagiotis T.,"One of the rare times I’ve ever felt disappointed that I couldn’t give a course more than 5 stars! This course far exceeded my expectations. Consider these 17.5 hours one of the best investments you can make in yourself, learning extremely valuable and practical methods to implement automation, not only with n8n but also by integrating it with other amazing AI tools. If you asked me whether I’d recommend this course, I’d say: Don’t ask rhetorical questions! Grab it while it’s still available!",5.0,5.0,4 months ago
udemy_data (14).xlsx,https://www.udemy.com/course/n8n-course/?couponCode=MT250929G3,n8n-course,Patrick H.,Many parts of the course are hazy and lacking in full resources and instructions.,3.0,5.0,3 months ago
udemy_data (14).xlsx,https://www.udemy.com/course/n8n-course/?couponCode=MT250929G3,n8n-course,Carlos Martins B.,"This course is a goldmine for no-code automation enthusiasts — powerful tools, clear lessons, and lots of super useful templates to hit the ground running!",5.0,5.0,4 months ago
udemy_data (14).xlsx,https://www.udemy.com/course/n8n-course/?couponCode=MT250929G3,n8n-course,Eugene R.,very powerfull material,5.0,5.0,1 month ago
udemy_data (14).xlsx,https://www.udemy.com/course/n8n-course/?couponCode=MT250929G3,n8n-course,Semesta A.,THIS IS SO GREAT im became understand n8n because this course,5.0,5.0,2 weeks ago
udemy_data (14).xlsx,https://www.udemy.com/course/n8n-course/?couponCode=MT250929G3,n8n-course,Pritam B.,"One of the best course on Udemy is you want to learn AI Automation and building AI Agent. Keep up the good work, really appreciate for this course. Thank you",5.0,5.0,4 months ago
udemy_data (14).xlsx,https://www.udemy.com/course/n8n-course/?couponCode=MT250929G3,n8n-course,Anthony J.,"Damian's mic sounds a bit too far away, can't really hear him clearly even with 100% volume on my Laptop. And his explanations are a bit unstructured which is hard for beginners to understand.",2.0,5.0,1 month ago
udemy_data (14).xlsx,https://www.udemy.com/course/n8n-course/?couponCode=MT250929G3,n8n-course,Juan Andrés B.,"Exelente, super recomendable",5.0,5.0,1 month ago
udemy_data (14).xlsx,https://www.udemy.com/course/n8n-course/?couponCode=MT250929G3,n8n-course,Shweta S.,SOME OF THE LECTURES ARE LIKE NOT UNDERSTANDABLE IT DONT HELP HOW TO CONNECT APP SIMULTANEOUSLY THAT TAKES A LOT OF TIME MAKE IT HARD TO UNDERSTOOD THE LECTURE,3.0,5.0,2 months ago
udemy_data (14).xlsx,https://www.udemy.com/course/n8n-course/?couponCode=MT250929G3,n8n-course,Aminu S.,"I'm pretty new to workflow automation, so I wasn't sure what to expect from this n8n course—but it's been a great surprise. The lessons are super beginner-friendly and build things up nicely from the basics. I’ve made it about halfway through and already feel a lot more confident. It’s fun to follow along, and the examples actually help things stick. Can’t wait to see what else I’ll learn in the rest of the course.",5.0,5.0,3 months ago
udemy_data (14).xlsx,https://www.udemy.com/course/n8n-course/?couponCode=MT250929G3,n8n-course,Vincent L.,Never regret watching this course.,5.0,5.0,4 weeks ago
udemy_data (14).xlsx,https://www.udemy.com/course/n8n-course/?couponCode=MT250929G3,n8n-course,lior D.,course quality is great,5.0,5.0,5 days ago
udemy_data (14).xlsx,https://www.udemy.com/course/n8n-course/?couponCode=MT250929G3,n8n-course,Abhay Singh R.,best course (5/5),5.0,5.0,2 months ago
udemy_data (14).xlsx,https://www.udemy.com/course/n8n-course/?couponCode=MT250929G3,n8n-course,EUGENE Y.,Very good structure and content and in particular the real life cases and taking every step into account!! Thank you!!,5.0,5.0,3 months ago
udemy_data (14).xlsx,https://www.udemy.com/course/n8n-course/?couponCode=MT250929G3,n8n-course,Victor O.,"People who are startinng to go into workflow automation, I'll advice you go through this course. It's a learning booster for me.",5.0,5.0,2 weeks ago
udemy_data (14).xlsx,https://www.udemy.com/course/n8n-course/?couponCode=MT250929G3,n8n-course,Mar louied L.,I hope the prompts and some of the documents are also in the resource section.,3.5,5.0,1 month ago
udemy_data (14).xlsx,https://www.udemy.com/course/n8n-course/?couponCode=MT250929G3,n8n-course,Brian S.,Well-organized! Many great examples and use cases! I highly recommend this course for beginners and advanced automators.,5.0,5.0,4 months ago
udemy_data (14).xlsx,https://www.udemy.com/course/n8n-course/?couponCode=MT250929G3,n8n-course,Géza K.,"It's really a masterclass. I love the structure of the overall course as it's built up very logically. It's easy to follow, interesting to learn and suits to the natural learning process of the brain. You get enough examples at first, then you get the theory behind and you'll finally get more and more complex examples.",5.0,5.0,2 months ago
udemy_data (14).xlsx,https://www.udemy.com/course/n8n-course/?couponCode=MT250929G3,n8n-course,Murali K.,Good,4.5,5.0,2 months ago
udemy_data (14).xlsx,https://www.udemy.com/course/n8n-course/?couponCode=MT250929G3,n8n-course,Azaan S.,The pdf files didnt give the full prompt if the line was longer which made it difficult to write down them.,4.0,5.0,4 months ago
udemy_data (14).xlsx,https://www.udemy.com/course/n8n-course/?couponCode=MT250929G3,n8n-course,Kiransitaram,"The explanation is good. Except for some words which I cannot understand due to the pronounciation due to which I had to use the captions on - for example ""general"" sounds like ""jural"" etc.... Otherwise, the course looks good. Easy to understand",4.0,5.0,3 months ago
udemy_data (14).xlsx,https://www.udemy.com/course/n8n-course/?couponCode=MT250929G3,n8n-course,Rajesh G.,Theoretical concepts & practical implementation are simply superb!,5.0,5.0,4 months ago
udemy_data (14).xlsx,https://www.udemy.com/course/n8n-course/?couponCode=MT250929G3,n8n-course,Salman G.,The configuration does not work. I followed everything step by step and am stuck.,1.0,5.0,2 months ago
udemy_data (14).xlsx,https://www.udemy.com/course/n8n-course/?couponCode=MT250929G3,n8n-course,Stalyn C.,"Muy buena explicación, pero los videos deberia actualizarse ya que n8n actualiza las herramientas y funciones cada tiempo",3.5,5.0,3 weeks ago
udemy_data (14).xlsx,https://www.udemy.com/course/n8n-course/?couponCode=MT250929G3,n8n-course,Rafael K.,"I have just started this course, and it's exactly the type of learning experience I need right now. The course is a bit rough around the edges since it is Damian's first course and is constantly evolving — but that's actually great; it feels exciting to be part of that journey. Damian seems very knowledgeable about the subject and is pragmatic and hands-on in his approach. I plan to complete the entire course this week, and I’m excited to get started. Thanks a lot for putting this course together, Damian!",4.5,5.0,5 months ago
udemy_data (14).xlsx,https://www.udemy.com/course/n8n-course/?couponCode=MT250929G3,n8n-course,Sneha Sree R J.,I love the amazing idea of Roleplay. It gives me confidence to interact based on the skills learnt. I would always recommend this course to anyone who loves exploring automation set-up. Eager to learn more.,5.0,5.0,1 month ago
udemy_data (14).xlsx,https://www.udemy.com/course/n8n-course/?couponCode=MT250929G3,n8n-course,Dionysios K.,Great Job with love and passion in their lectures to really teach people knowledge and skills . thanks,5.0,5.0,2 months ago
udemy_data (14).xlsx,https://www.udemy.com/course/n8n-course/?couponCode=MT250929G3,n8n-course,ProgramadorVPT,"The course is not well structured, the information is not delivered in a logical and clear way, nor totally complete in many points.",1.0,5.0,3 months ago
udemy_data (14).xlsx,https://www.udemy.com/course/n8n-course/?couponCode=MT250929G3,n8n-course,Babu D.,Fantastic. Easy to learn,5.0,5.0,1 month ago
udemy_data (14).xlsx,https://www.udemy.com/course/n8n-course/?couponCode=MT250929G3,n8n-course,M Diego T.,"I think you guys should have shown more for e.g: yoiu guys could say this works the same if you want to do this and that. so that the student can already apply to their reality. But i like it, clear",3.0,5.0,3 weeks ago
udemy_data (14).xlsx,https://www.udemy.com/course/n8n-course/?couponCode=MT250929G3,n8n-course,Iftekhar R.,Its a very helpful course everybody should get it asap!,5.0,5.0,4 months ago
udemy_data (14).xlsx,https://www.udemy.com/course/n8n-course/?couponCode=MT250929G3,n8n-course,Monique S.,Fanatstisch schon nach der ersten Lektion. ich empfehle es 1000% sich diesen Kurs zu kaufen,5.0,5.0,2 weeks ago
udemy_data (14).xlsx,https://www.udemy.com/course/n8n-course/?couponCode=MT250929G3,n8n-course,Stephane P.,"This course offers a clear and hands-on approach, walking us through the essential learning curve to understand how AI agents can be leveraged in meaningful, real-life situations — both for companies and individuals.",5.0,5.0,4 months ago
udemy_data (14).xlsx,https://www.udemy.com/course/n8n-course/?couponCode=MT250929G3,n8n-course,César S.,"Es el mejor curso de automatización que he realizado en mi vida. Gracias a estos dos profesionales, mi destino profesional ha cambiado radicalmente. Hasta ahora estaba atascado en un trabajo que no me hacía feliz y desde que he descubierto cómo trabajar con n8n y todo lo relacionado con la inteligencia artificial, por fin siento que mi vida vuelve a recobrar sentido. No puedo estar más que agradecido con Krystian y Damian. Gracias!!!",5.0,5.0,2 weeks ago
udemy_data (14).xlsx,https://www.udemy.com/course/n8n-course/?couponCode=MT250929G3,n8n-course,Ayman,شكرا جزيلا على التعليم المبسط مع دلك اتعلم باالترجمة العربية افضل دورة على الاطلاق لا اعرف هل مازلت لم اغوص في الدوره ولكن البدايه كانت ممتازه,5.0,5.0,1 week ago
udemy_data (14).xlsx,https://www.udemy.com/course/n8n-course/?couponCode=MT250929G3,n8n-course,Crisan M.,"Most of the theory course is a bunch of Powerpoint slides that the instructor basically reads and it's quite boring to watch. Also, a lot of the lessons are from another, older course that were somehow added to this one, but the quality is poor.",2.0,5.0,3 months ago
udemy_data (14).xlsx,https://www.udemy.com/course/n8n-course/?couponCode=MT250929G3,n8n-course,Monica F.,The gentlemen are clearly talented at development...but I find Dan very hard to understand (so sorry).,3.0,5.0,1 week ago
udemy_data (14).xlsx,https://www.udemy.com/course/n8n-course/?couponCode=MT250929G3,n8n-course,Gregory O.,Wonderful course - much better than I expected!,5.0,5.0,1 month ago
udemy_data (14).xlsx,https://www.udemy.com/course/n8n-course/?couponCode=MT250929G3,n8n-course,Mark S.,Absolutely brilliant...easy to follow and very creative!,5.0,5.0,3 months ago
udemy_data (14).xlsx,https://www.udemy.com/course/n8n-course/?couponCode=MT250929G3,n8n-course,Deborah C.,"Great course, very well explained",5.0,5.0,1 week ago
udemy_data (14).xlsx,https://www.udemy.com/course/n8n-course/?couponCode=MT250929G3,n8n-course,Srinivasan A.,Course is not well structured...,1.0,5.0,1 month ago
udemy_data (14).xlsx,https://www.udemy.com/course/n8n-course/?couponCode=MT250929G3,n8n-course,Abdulrahman O.,"I was completely disappointed with learning n8n in YouTube until I found this course that opened a new door to me, with just a few lessons I learned a lot about n8n and fixed all my errors, I highly recommend this course because I haven't seen such course before I used to use YouTube to learn n8n but now I don't need it because I found the best course.",5.0,5.0,3 months ago
udemy_data (14).xlsx,https://www.udemy.com/course/n8n-course/?couponCode=MT250929G3,n8n-course,Anurag S.,Great thanks to creator of this course !!!!,5.0,5.0,5 months ago
udemy_data (14).xlsx,https://www.udemy.com/course/n8n-course/?couponCode=MT250929G3,n8n-course,Chandan S.,"Yes this is very practical & knowledge sharing tutorial suitable for any beginner or expert that want to quickly start a career into AI automation, AI agents & AI assistance.",4.0,5.0,4 months ago
udemy_data (14).xlsx,https://www.udemy.com/course/n8n-course/?couponCode=MT250929G3,n8n-course,Sudhindra,The instructor has a very bad accent and to understand him is not a easy task. Lot of your attention goes into trying to listen what he is saying.,1.0,5.0,2 months ago
udemy_data (14).xlsx,https://www.udemy.com/course/n8n-course/?couponCode=MT250929G3,n8n-course,Jefferson A.,https://www.udemy.com/course/n8n-course/learn/lecture/49927669#announcements/12460797/,1.0,5.0,2 weeks ago
udemy_data (14).xlsx,https://www.udemy.com/course/n8n-course/?couponCode=MT250929G3,n8n-course,Gürkan Berk S.,Their English accent is horrible!!!!,1.0,5.0,3 weeks ago
udemy_data (14).xlsx,https://www.udemy.com/course/n8n-course/?couponCode=MT250929G3,n8n-course,Santhan,"While the course is good, in one particular session I was expecting the tutor to teach how to connect Google Sheets to n8n. Since that part wasn't taught it got me confused.",3.0,5.0,4 months ago
udemy_data (14).xlsx,https://www.udemy.com/course/n8n-course/?couponCode=MT250929G3,n8n-course,Shaily P.,Fun learning this course. Got to learn a lot,4.0,5.0,2 months ago
udemy_data (14).xlsx,https://www.udemy.com/course/n8n-course/?couponCode=MT250929G3,n8n-course,Nikhil U.,"a few things in the course have been skipped. the agent tutorial doesn't cover all the nodes. There's no information on how to replace the bearer token, assistant id, phone number id, etc. for the phone call agent.",1.0,5.0,4 months ago
udemy_data (14).xlsx,https://www.udemy.com/course/n8n-course/?couponCode=MT250929G3,n8n-course,Essence H.,So far I'm really enjoying this course! I've already been able to build some time-saving personal and business workflows using what I've learned from the lessons. It is easy to understand and beginner friendly. The community has also proven to be a great resource. I went into this course with zero knowledge of AI automation and now I feel so much more confident in my skills so that's a win!,5.0,5.0,3 months ago
udemy_data (14).xlsx,https://www.udemy.com/course/n8n-course/?couponCode=MT250929G3,n8n-course,Adrian B.,I am not sure how to get help with trouble shooting when I have issues with some of the projects.,4.5,5.0,3 months ago
udemy_data (14).xlsx,https://www.udemy.com/course/n8n-course/?couponCode=MT250929G3,n8n-course,Jesse C.,So far so good. Did need to supplement a few topics with other videos on Youtube but it overall covers some great basics.,4.0,5.0,3 months ago
udemy_data (14).xlsx,https://www.udemy.com/course/n8n-course/?couponCode=MT250929G3,n8n-course,Abhay S.,good and appreciable teaching,5.0,5.0,1 month ago
udemy_data (14).xlsx,https://www.udemy.com/course/n8n-course/?couponCode=MT250929G3,n8n-course,Rishab B.,not that much good,2.0,5.0,4 weeks ago
udemy_data (14).xlsx,https://www.udemy.com/course/n8n-course/?couponCode=MT250929G3,n8n-course,Salman A.,"I worked on a few workflows before this course, but from this video, I have learned many things",5.0,5.0,2 weeks ago
udemy_data (14).xlsx,https://www.udemy.com/course/n8n-course/?couponCode=MT250929G3,n8n-course,Reuben P.,Every nook and cranny is explained to the Tees!,5.0,5.0,1 month ago
udemy_data (14).xlsx,https://www.udemy.com/course/n8n-course/?couponCode=MT250929G3,n8n-course,Jen G.,"So far the information is good, but it's difficult to understand what they are saying. The accent is rather thick and there are extra words, like ""really"", ""you know"" and ""like"" in odd places. I had to turn on subtitles so I could keep up.",3.5,5.0,1 month ago
udemy_data (14).xlsx,https://www.udemy.com/course/n8n-course/?couponCode=MT250929G3,n8n-course,Akash C.,Good,5.0,5.0,2 months ago
udemy_data (14).xlsx,https://www.udemy.com/course/n8n-course/?couponCode=MT250929G3,n8n-course,Hari B.,very good implementation,5.0,5.0,3 months ago
udemy_data (14).xlsx,https://www.udemy.com/course/n8n-course/?couponCode=MT250929G3,n8n-course,Ezra M.,I love how seamless the introduction to the concepts has been. I love it!,4.5,5.0,1 week ago
udemy_data (14).xlsx,https://www.udemy.com/course/n8n-course/?couponCode=MT250929G3,n8n-course,Kavya,"till now, its good a I'm focusing on custom workflow, once I get to know how to connect to custom apps then will let you know exact rating and whether taking this course is a right choice.",3.5,5.0,4 months ago
udemy_data (14).xlsx,https://www.udemy.com/course/n8n-course/?couponCode=MT250929G3,n8n-course,Blaine H.,Practical exercises and the information is super digestiable,5.0,5.0,3 months ago
udemy_data (14).xlsx,https://www.udemy.com/course/n8n-course/?couponCode=MT250929G3,n8n-course,Anahi B.,Good course.,4.5,5.0,3 months ago
udemy_data (14).xlsx,https://www.udemy.com/course/n8n-course/?couponCode=MT250929G3,n8n-course,Dj J.,I love this course and help learning and growing!,5.0,5.0,3 months ago
udemy_data (14).xlsx,https://www.udemy.com/course/n8n-course/?couponCode=MT250929G3,n8n-course,定凱,"So far, it’s quite good. The teacher mainly provides space for self-reflection and hands-on practice, making it worth learning gradually.",4.5,5.0,4 months ago
udemy_data (14).xlsx,https://www.udemy.com/course/n8n-course/?couponCode=MT250929G3,n8n-course,Linden H.,Excellent course with excellent teachers. 5 Stars :),5.0,5.0,4 months ago
udemy_data (14).xlsx,https://www.udemy.com/course/n8n-course/?couponCode=MT250929G3,n8n-course,muhammad hassan,"next level,loved it yet affordable",5.0,5.0,1 month ago
udemy_data (14).xlsx,https://www.udemy.com/course/n8n-course/?couponCode=MT250929G3,n8n-course,Julio Ernesto Contreras R.,So far so good !,5.0,5.0,1 month ago
udemy_data (14).xlsx,https://www.udemy.com/course/n8n-course/?couponCode=MT250929G3,n8n-course,Hebert C.,So far so good.,5.0,5.0,3 months ago
udemy_data (14).xlsx,https://www.udemy.com/course/n8n-course/?couponCode=MT250929G3,n8n-course,Yassir,"Waouuuu ..... I don't think anymore about price/cost ..... This course content is crazy .... The job was done, and it's largely affordable.... follow the courses and the teachers.",4.5,5.0,2 months ago
