source_file,course_url,course_slug,reviewer_name,review_text,rating_value,rating_scale,review_time_relative
udemy_data (14).xlsx,https://www.udemy.com/course/n8n-course/?couponCode=MT250929G3,n8n-course,Vineet M.,Good,5.0,5.0,2 months ago
udemy_data (14).xlsx,https://www.udemy.com/course/n8n-course/?couponCode=MT250929G3,n8n-course,Udemy User,This is the worst course ive ever enrolled. Do NOT buy this course!,1.0,5.0,4 weeks ago
udemy_data (14).xlsx,https://www.udemy.com/course/n8n-course/?couponCode=MT250929G3,n8n-course,Declan M.,Very clear instructions. The instructor makes it easy to follow.,5.0,5.0,1 month ago
udemy_data (14).xlsx,https://www.udemy.com/course/n8n-course/?couponCode=MT250929G3,n8n-course,Zack F.,"Helpful, practical, leading edge information.",5.0,5.0,3 weeks ago
udemy_data (14).xlsx,https://www.udemy.com/course/n8n-course/?couponCode=MT250929G3,n8n-course,Vishal V.,Perfect Course to start with in the AI world,5.0,5.0,1 month ago
udemy_data (14).xlsx,https://www.udemy.com/course/n8n-course/?couponCode=MT250929G3,n8n-course,Hartadi,simple and easy to understand,5.0,5.0,1 month ago
udemy_data (14).xlsx,https://www.udemy.com/course/n8n-course/?couponCode=MT250929G3,n8n-course,Nakul K.,"it's just beginning and it helped me to get comfortable with automation stack, specifically with n8n",4.5,5.0,2 months ago
udemy_data (14).xlsx,https://www.udemy.com/course/n8n-course/?couponCode=MT250929G3,n8n-course,Amruth R.,The voice is not clear,3.0,5.0,3 months ago
udemy_data (14).xlsx,https://www.udemy.com/course/n8n-course/?couponCode=MT250929G3,n8n-course,Nnaemeka P.,Yes i am glad i am taking this course,5.0,5.0,1 month ago
udemy_data (14).xlsx,https://www.udemy.com/course/n8n-course/?couponCode=MT250929G3,n8n-course,Sarah M.,The acent encourages me to focus on the content and to pay attention to the learnings availabel.,4.0,5.0,4 months ago
udemy_data (14).xlsx,https://www.udemy.com/course/n8n-course/?couponCode=MT250929G3,n8n-course,Souleymane D.,"i'm new in the topic, i find the course very interesting",4.5,5.0,3 months ago
udemy_data (14).xlsx,https://www.udemy.com/course/n8n-course/?couponCode=MT250929G3,n8n-course,Bhagyashree M.,good,4.0,5.0,2 months ago
udemy_data (14).xlsx,https://www.udemy.com/course/n8n-course/?couponCode=MT250929G3,n8n-course,ROHIT G.,i can understand easly and properly,4.5,5.0,1 month ago
udemy_data (14).xlsx,https://www.udemy.com/course/n8n-course/?couponCode=MT250929G3,n8n-course,Manoj N.,Have been working a lot on n8n recently. It was more of finding YouTube videos and online guides. This course helped clear some of my concepts. Jumped straight to Section 4 and started on the build your own part as I already have a hostinger n8n instance to play around with.,4.0,5.0,1 month ago
udemy_data (14).xlsx,https://www.udemy.com/course/n8n-course/?couponCode=MT250929G3,n8n-course,Geoffrey L.,Topics clearly explained with illustrations,5.0,5.0,4 months ago
udemy_data (14).xlsx,https://www.udemy.com/course/n8n-course/?couponCode=MT250929G3,n8n-course,Alex G.,"Fue dificil encontrar el botón de los subtítulos y, la verdad, las 2 personas que hablan, lo hacen muy rápido y con no muy buen inglés.",3.5,5.0,1 month ago
udemy_data (14).xlsx,https://www.udemy.com/course/n8n-course/?couponCode=MT250929G3,n8n-course,Gary G.,The examples given were easy to follow and the steps were presented in a way that kept it simple and avoided confusion.,5.0,5.0,2 months ago
udemy_data (14).xlsx,https://www.udemy.com/course/n8n-course/?couponCode=MT250929G3,n8n-course,Gandla Hari Krishna S.,So far the course is good.,5.0,5.0,1 month ago
udemy_data (14).xlsx,https://www.udemy.com/course/n8n-course/?couponCode=MT250929G3,n8n-course,UT C.,I like how you explain everything in details and try to use easy to understand English even for non-native to understand.,4.5,5.0,1 month ago
udemy_data (14).xlsx,https://www.udemy.com/course/n8n-course/?couponCode=MT250929G3,n8n-course,Solomon O.,"Very good introduction to n8n, but having issues with the video due to the network",3.0,5.0,4 months ago
udemy_data (14).xlsx,https://www.udemy.com/course/n8n-course/?couponCode=MT250929G3,n8n-course,Covenant G.,Its so so amazing,4.5,5.0,3 weeks ago
udemy_data (14).xlsx,https://www.udemy.com/course/n8n-course/?couponCode=MT250929G3,n8n-course,Mark Erwell S. L.,"If you’re serious about freelancing in AI automation, this Udemy n8n course gives you actionable skills, real templates, and business-ready insights—all without writing a single line of code. You’ll walk away equipped to build meaningful workflows, integrate cutting-edge AI, and even launch your own small agency.",5.0,5.0,3 months ago
udemy_data (14).xlsx,https://www.udemy.com/course/n8n-course/?couponCode=MT250929G3,n8n-course,Dominik J.,Mega kurs,5.0,5.0,3 months ago
udemy_data (14).xlsx,https://www.udemy.com/course/n8n-course/?couponCode=MT250929G3,n8n-course,hussein F.,great,5.0,5.0,3 months ago
udemy_data (14).xlsx,https://www.udemy.com/course/n8n-course/?couponCode=MT250929G3,n8n-course,OVERFLOW IT OPC PRIVATE LIMITED ..,"Super helpful course, simple and practical!",5.0,5.0,5 months ago
udemy_data (14).xlsx,https://www.udemy.com/course/n8n-course/?couponCode=MT250929G3,n8n-course,Hiranmayee P.,"Just get started, have a very good feeling just with the introductory videos",5.0,5.0,4 weeks ago
udemy_data (14).xlsx,https://www.udemy.com/course/n8n-course/?couponCode=MT250929G3,n8n-course,Trevor L.,It does need some concentration to hear through the accents. This does mean my focus is on trying to listen to understand the words and makes it tougher to process the content,3.5,5.0,2 months ago
udemy_data (14).xlsx,https://www.udemy.com/course/n8n-course/?couponCode=MT250929G3,n8n-course,Adekoya Olalekan A.,Very practical and good,5.0,5.0,2 months ago
udemy_data (14).xlsx,https://www.udemy.com/course/n8n-course/?couponCode=MT250929G3,n8n-course,dichodeotramanera,"Amazing, simply amazing. Great content",5.0,5.0,3 months ago
udemy_data (14).xlsx,https://www.udemy.com/course/n8n-course/?couponCode=MT250929G3,n8n-course,Adeniji J.,The depth of approach is beautiful,5.0,5.0,1 month ago
udemy_data (14).xlsx,https://www.udemy.com/course/n8n-course/?couponCode=MT250929G3,n8n-course,Munir H.,I have paid for this course just because of an amazing course contents.,5.0,5.0,1 month ago
udemy_data (14).xlsx,https://www.udemy.com/course/n8n-course/?couponCode=MT250929G3,n8n-course,Anurag C.,Best Course so far everything is clearly explained.,5.0,5.0,5 months ago
udemy_data (14).xlsx,https://www.udemy.com/course/n8n-course/?couponCode=MT250929G3,n8n-course,Shubham T.,So far it was good now need to deep dive into other videos and sections so I get to know how useful it is,5.0,5.0,3 weeks ago
udemy_data (14).xlsx,https://www.udemy.com/course/n8n-course/?couponCode=MT250929G3,n8n-course,ArmorBearerSlave@gmail.com,"Much needed guidance with working with Google Sheets, and Gmail. Thanks for the introduction to the Form Trigger.",5.0,5.0,3 months ago
udemy_data (14).xlsx,https://www.udemy.com/course/n8n-course/?couponCode=MT250929G3,n8n-course,Elie K.,"Because as far as I ser the videos, learn a lot",5.0,5.0,2 months ago
udemy_data (14).xlsx,https://www.udemy.com/course/n8n-course/?couponCode=MT250929G3,n8n-course,Varun S.,Explaining everything very deeply which helps to clear all doubts.,5.0,5.0,3 months ago
udemy_data (14).xlsx,https://www.udemy.com/course/n8n-course/?couponCode=MT250929G3,n8n-course,Brian,Great course. Very informative and practical with lots of useful templates to get you starated.,5.0,5.0,1 month ago
udemy_data (14).xlsx,https://www.udemy.com/course/n8n-course/?couponCode=MT250929G3,n8n-course,Andrei,"I like this course, everything is properly explained. The course is good for anyone who wants to move forward with AI and choose no-code n8n as a base.",5.0,5.0,4 months ago
udemy_data (14).xlsx,https://www.udemy.com/course/n8n-course/?couponCode=MT250929G3,n8n-course,SUDEEP B.,Easy to learn.,5.0,5.0,1 month ago
udemy_data (14).xlsx,https://www.udemy.com/course/n8n-course/?couponCode=MT250929G3,n8n-course,Elisha Osei T.,absolutely educational giant in IT,5.0,5.0,3 weeks ago
udemy_data (14).xlsx,https://www.udemy.com/course/n8n-course/?couponCode=MT250929G3,n8n-course,Kerry M.,Getting into the interesting stuff really fast and explaining it all clearly!,5.0,5.0,3 months ago
udemy_data (14).xlsx,https://www.udemy.com/course/n8n-course/?couponCode=MT250929G3,n8n-course,Miguel L.,I am very excited to start this course!,5.0,5.0,2 weeks ago
udemy_data (14).xlsx,https://www.udemy.com/course/n8n-course/?couponCode=MT250929G3,n8n-course,Ernest L.,"quick, clean, helpful tips that will help everyone!",5.0,5.0,2 months ago
udemy_data (14).xlsx,https://www.udemy.com/course/n8n-course/?couponCode=MT250929G3,n8n-course,Debyani R.,Good explaination and easy to catch up.,5.0,5.0,1 month ago
udemy_data (14).xlsx,https://www.udemy.com/course/n8n-course/?couponCode=MT250929G3,n8n-course,Mahmudul A.,I think this is a great tutorial. Thanks,5.0,5.0,1 week ago
udemy_data (14).xlsx,https://www.udemy.com/course/n8n-course/?couponCode=MT250929G3,n8n-course,Charles,,4.5,5.0,3 months ago
udemy_data (14).xlsx,https://www.udemy.com/course/n8n-course/?couponCode=MT250929G3,n8n-course,Sahil S.,nice,4.5,5.0,2 weeks ago
udemy_data (14).xlsx,https://www.udemy.com/course/n8n-course/?couponCode=MT250929G3,n8n-course,Ann P.,Easy to understand the basic steps. Thanks,5.0,5.0,3 months ago
udemy_data (14).xlsx,https://www.udemy.com/course/n8n-course/?couponCode=MT250929G3,n8n-course,Shoaib H.,great,5.0,5.0,3 weeks ago
udemy_data (14).xlsx,https://www.udemy.com/course/n8n-course/?couponCode=MT250929G3,n8n-course,John L.,"Excellent, beginner friendly",5.0,5.0,1 month ago
udemy_data (14).xlsx,https://www.udemy.com/course/n8n-course/?couponCode=MT250929G3,n8n-course,Praksh S.,"The introduction was good but the accent of the tutor was not good, it's hard to understand without captions.",4.5,5.0,1 month ago
udemy_data (14).xlsx,https://www.udemy.com/course/n8n-course/?couponCode=MT250929G3,n8n-course,Chitteshwar M.,one of the best ways to learn n8n,5.0,5.0,1 month ago
udemy_data (14).xlsx,https://www.udemy.com/course/n8n-course/?couponCode=MT250929G3,n8n-course,John A.,Its been great so far. I'm enjoying the hands-on practical aspect of it.,4.5,5.0,4 months ago
udemy_data (14).xlsx,https://www.udemy.com/course/n8n-course/?couponCode=MT250929G3,n8n-course,Udemy User,"It has been good so far, Looking forward!",5.0,5.0,1 week ago
udemy_data (14).xlsx,https://www.udemy.com/course/n8n-course/?couponCode=MT250929G3,n8n-course,Muhammad M.,Great Course as yet,5.0,5.0,2 months ago
udemy_data (14).xlsx,https://www.udemy.com/course/n8n-course/?couponCode=MT250929G3,n8n-course,Anonymized U.,great,5.0,5.0,3 months ago
udemy_data (14).xlsx,https://www.udemy.com/course/n8n-course/?couponCode=MT250929G3,n8n-course,Gregory Patrick T.,Good,4.0,5.0,2 months ago
udemy_data (14).xlsx,https://www.udemy.com/course/n8n-course/?couponCode=MT250929G3,n8n-course,Peter J.,Just started this course and looks really useful. Seems to be oriented towards commercially useful workflows rather than just proof of concepts,5.0,5.0,5 months ago
udemy_data (14).xlsx,https://www.udemy.com/course/n8n-course/?couponCode=MT250929G3,n8n-course,Idnan A.,Very Information,5.0,5.0,4 weeks ago
udemy_data (14).xlsx,https://www.udemy.com/course/n8n-course/?couponCode=MT250929G3,n8n-course,Arrish N.,Introduction to the course was good. Understandable and accurate.,5.0,5.0,2 months ago
udemy_data (14).xlsx,https://www.udemy.com/course/n8n-course/?couponCode=MT250929G3,n8n-course,Guillaume T.,so far so good! Clear!,5.0,5.0,1 week ago
udemy_data (14).xlsx,https://www.udemy.com/course/n8n-course/?couponCode=MT250929G3,n8n-course,Artur P.,Good so far,5.0,5.0,1 month ago
udemy_data (14).xlsx,https://www.udemy.com/course/n8n-course/?couponCode=MT250929G3,n8n-course,H M S.,This is an amazing course on free automation with n8n. It is great for both the beginner and the semi advance level learner.,5.0,5.0,4 months ago
udemy_data (14).xlsx,https://www.udemy.com/course/n8n-course/?couponCode=MT250929G3,n8n-course,AVINASH A.,its grt start... lets proceed ..looking fwd to have a grt experience,3.0,5.0,3 months ago
udemy_data (14).xlsx,https://www.udemy.com/course/n8n-course/?couponCode=MT250929G3,n8n-course,Obianuju A.,Great course.,4.5,5.0,3 months ago
udemy_data (14).xlsx,https://www.udemy.com/course/n8n-course/?couponCode=MT250929G3,n8n-course,Charles P.,"I like these guys and while the course seems like it will take a long time, it seems very comprehensive. Also, considering how quickly technology is developing right now, I'm glad that the course is being constantly updated and that I can sign up for update notifications.",5.0,5.0,1 month ago
udemy_data (14).xlsx,https://www.udemy.com/course/n8n-course/?couponCode=MT250929G3,n8n-course,Jeffrey J.,Outstanding course...,4.5,5.0,2 months ago
udemy_data (14).xlsx,https://www.udemy.com/course/n8n-course/?couponCode=MT250929G3,n8n-course,Lukas E.,This is the most fun udemy course ever,5.0,5.0,4 months ago
udemy_data (14).xlsx,https://www.udemy.com/course/n8n-course/?couponCode=MT250929G3,n8n-course,Pankaj W.,"Yeah, Course well designed & ease to learn",4.0,5.0,3 months ago
udemy_data (14).xlsx,https://www.udemy.com/course/n8n-course/?couponCode=MT250929G3,n8n-course,Garth N.,The instructors seems very eager to teach and want their client to learn the material.,5.0,5.0,2 months ago
udemy_data (14).xlsx,https://www.udemy.com/course/n8n-course/?couponCode=MT250929G3,n8n-course,Syed Muhammad Saad A.,Too fast,1.0,5.0,1 month ago
udemy_data (14).xlsx,https://www.udemy.com/course/n8n-course/?couponCode=MT250929G3,n8n-course,Rajesh R.,Good and step by step explanation !,4.0,5.0,2 months ago
udemy_data (14).xlsx,https://www.udemy.com/course/n8n-course/?couponCode=MT250929G3,n8n-course,Mohammed Hezam H A.,great...,5.0,5.0,5 days ago
udemy_data (14).xlsx,https://www.udemy.com/course/n8n-course/?couponCode=MT250929G3,n8n-course,Ali H.,accent problems,4.0,5.0,1 month ago
udemy_data (14).xlsx,https://www.udemy.com/course/n8n-course/?couponCode=MT250929G3,n8n-course,Jacobo C.,Great introduction,5.0,5.0,3 months ago
udemy_data (14).xlsx,https://www.udemy.com/course/n8n-course/?couponCode=MT250929G3,n8n-course,Robert J.,very clear description of the course and how to benefit from it.,4.5,5.0,2 months ago
udemy_data (14).xlsx,https://www.udemy.com/course/n8n-course/?couponCode=MT250929G3,n8n-course,Behzad P.,How to remove in the form n8n brand at bottom of form,5.0,5.0,4 months ago
udemy_data (14).xlsx,https://www.udemy.com/course/n8n-course/?couponCode=MT250929G3,n8n-course,Michael L.,Super Kurs.,5.0,5.0,2 months ago
udemy_data (14).xlsx,https://www.udemy.com/course/n8n-course/?couponCode=MT250929G3,n8n-course,Sushmita N.,good,4.5,5.0,1 month ago
udemy_data (14).xlsx,https://www.udemy.com/course/n8n-course/?couponCode=MT250929G3,n8n-course,Adri Praharja T.,Engaging course presentation.,5.0,5.0,2 months ago
udemy_data (14).xlsx,https://www.udemy.com/course/n8n-course/?couponCode=MT250929G3,n8n-course,James L.,Nice and concise,5.0,5.0,1 month ago
udemy_data (14).xlsx,https://www.udemy.com/course/n8n-course/?couponCode=MT250929G3,n8n-course,Martin,Easy to follow and concise.,5.0,5.0,4 months ago
udemy_data (14).xlsx,https://www.udemy.com/course/n8n-course/?couponCode=MT250929G3,n8n-course,Stanley M.,Very clear information and instructions,5.0,5.0,2 months ago
udemy_data (14).xlsx,https://www.udemy.com/course/n8n-course/?couponCode=MT250929G3,n8n-course,Rod F.,"Guys,",5.0,5.0,4 months ago
udemy_data (14).xlsx,https://www.udemy.com/course/n8n-course/?couponCode=MT250929G3,n8n-course,Chinedu E.,just here to learn,4.0,5.0,1 month ago
udemy_data (14).xlsx,https://www.udemy.com/course/n8n-course/?couponCode=MT250929G3,n8n-course,Kitty C.,very good explanation,4.5,5.0,4 weeks ago
udemy_data (14).xlsx,https://www.udemy.com/course/n8n-course/?couponCode=MT250929G3,n8n-course,Ahmed F.,very good,5.0,5.0,3 weeks ago
udemy_data (14).xlsx,https://www.udemy.com/course/n8n-course/?couponCode=MT250929G3,n8n-course,Joyce H.,Clear and useful,5.0,5.0,3 months ago
udemy_data (14).xlsx,https://www.udemy.com/course/n8n-course/?couponCode=MT250929G3,n8n-course,Anthony I.,So far so clear and relatable,5.0,5.0,2 months ago
udemy_data (14).xlsx,https://www.udemy.com/course/n8n-course/?couponCode=MT250929G3,n8n-course,Jürgen S.,Alles gut un detailliert erklärt.,5.0,5.0,2 months ago
udemy_data (14).xlsx,https://www.udemy.com/course/n8n-course/?couponCode=MT250929G3,n8n-course,Asadbek J.,i am soo excited about its simplicity to understand even with the zero knowledge they are explaining nearly everything even the most tini parts,5.0,5.0,1 month ago
udemy_data (14).xlsx,https://www.udemy.com/course/n8n-course/?couponCode=MT250929G3,n8n-course,Colby N.,Great introduction to the course. The instructors are well spoken and explained everything well.,5.0,5.0,2 months ago
udemy_data (14).xlsx,https://www.udemy.com/course/n8n-course/?couponCode=MT250929G3,n8n-course,Shahzad G.,perfect course,5.0,5.0,1 month ago
udemy_data (14).xlsx,https://www.udemy.com/course/n8n-course/?couponCode=MT250929G3,n8n-course,ABertuchi,"Just finished the n8n online class and really enjoyed it. The lessons were super clear, easy to follow, and had a lot of real-life examples that made everything click. Even if you’re new to automation, it breaks things down in a way that makes it all feel doable. Definitely recommend it if you’re looking to get started with n8n and save time on repetitive tasks.",5.0,5.0,4 months ago
udemy_data (14).xlsx,https://www.udemy.com/course/n8n-course/?couponCode=MT250929G3,n8n-course,Chantel D.,"Really good breakdown, easy to follow",5.0,5.0,4 months ago
udemy_data (14).xlsx,https://www.udemy.com/course/n8n-course/?couponCode=MT250929G3,n8n-course,Atharv S.,amazing course,4.5,5.0,1 month ago
udemy_data (14).xlsx,https://www.udemy.com/course/n8n-course/?couponCode=MT250929G3,n8n-course,Muhammad Idris B.,good clear and easy to understand the slide show.,5.0,5.0,3 months ago
udemy_data (14).xlsx,https://www.udemy.com/course/n8n-course/?couponCode=MT250929G3,n8n-course,Marquette R.,"So far so good. Small issues where If I jump to another app, it logs me out.",5.0,5.0,2 months ago
udemy_data (14).xlsx,https://www.udemy.com/course/n8n-course/?couponCode=MT250929G3,n8n-course,PRAVEEN T.,Excellent and easy to follow,4.5,5.0,2 months ago
udemy_data (14).xlsx,https://www.udemy.com/course/n8n-course/?couponCode=MT250929G3,n8n-course,Victor J.,the course is best I have seen so far,4.0,5.0,4 months ago
udemy_data (14).xlsx,https://www.udemy.com/course/n8n-course/?couponCode=MT250929G3,n8n-course,Joshua N.,Audio and video are clear and they give a clear explanation on the couse content and what will be covered!,5.0,5.0,1 month ago
udemy_data (14).xlsx,https://www.udemy.com/course/n8n-course/?couponCode=MT250929G3,n8n-course,Marlon A.,This introduction was very detailed. Wow!,5.0,5.0,2 months ago
udemy_data (14).xlsx,https://www.udemy.com/course/n8n-course/?couponCode=MT250929G3,n8n-course,Daniel,NICE SET UP AND I KNOW I'LL LEARN ALOT FROM YOU,5.0,5.0,5 months ago
udemy_data (14).xlsx,https://www.udemy.com/course/n8n-course/?couponCode=MT250929G3,n8n-course,Udemy User,Looks promising but we will see in the future,4.5,5.0,3 months ago
udemy_data (14).xlsx,https://www.udemy.com/course/n8n-course/?couponCode=MT250929G3,n8n-course,Yomi O.,Good introduction,4.0,5.0,4 months ago
udemy_data (14).xlsx,https://www.udemy.com/course/n8n-course/?couponCode=MT250929G3,n8n-course,Chidumaga E.,It has been an amazing experience,5.0,5.0,2 months ago
udemy_data (14).xlsx,https://www.udemy.com/course/n8n-course/?couponCode=MT250929G3,n8n-course,Wilber B.,Training is going well.,5.0,5.0,2 months ago
udemy_data (14).xlsx,https://www.udemy.com/course/n8n-course/?couponCode=MT250929G3,n8n-course,Udemy User,"Si, esta interante",5.0,5.0,5 days ago
udemy_data (14).xlsx,https://www.udemy.com/course/n8n-course/?couponCode=MT250929G3,n8n-course,Vincent D.,"This course truly exceeded my expectations! The instructor does an excellent job of breaking down complex concepts into easy-to-understand lessons, making it accessible for both beginners and those with some experience. The course is hands-on, featuring practical projects that allow you to build real-world automations without any coding required. So perfect for someone like me who just started to explore this field. I particularly appreciated the clear, step-by-step guidance and the wealth of resources provided. Overall, this course is a fantastic introduction to AI automation with n8n and is perfect for anyone looking to streamline their workflows. Highly recommended!",4.5,5.0,4 months ago
udemy_data (14).xlsx,https://www.udemy.com/course/n8n-course/?couponCode=MT250929G3,n8n-course,Etim Justine I.,Excellent way of teaching,5.0,5.0,1 month ago
udemy_data (14).xlsx,https://www.udemy.com/course/n8n-course/?couponCode=MT250929G3,n8n-course,Tibor V.,Superb! 😊,5.0,5.0,5 months ago
udemy_data (14).xlsx,https://www.udemy.com/course/n8n-course/?couponCode=MT250929G3,n8n-course,Chetan P.,I appriciate the efforts,5.0,5.0,2 months ago
udemy_data (14).xlsx,https://www.udemy.com/course/n8n-course/?couponCode=MT250929G3,n8n-course,Phil C.,Great!!!,4.5,5.0,1 month ago
udemy_data (14).xlsx,https://www.udemy.com/course/n8n-course/?couponCode=MT250929G3,n8n-course,Demetrio T.,"I took this course, and I must say, it exceeded my expectations!",5.0,5.0,4 months ago
udemy_data (14).xlsx,https://www.udemy.com/course/n8n-course/?couponCode=MT250929G3,n8n-course,Raffay A.,I'm loving it,5.0,5.0,2 months ago
udemy_data (14).xlsx,https://www.udemy.com/course/n8n-course/?couponCode=MT250929G3,n8n-course,Mohammed A.,It has a serious value for such a price,5.0,5.0,3 months ago
udemy_data (14).xlsx,https://www.udemy.com/course/n8n-course/?couponCode=MT250929G3,n8n-course,Olubunmi O.,It's interesting and understandable,5.0,5.0,3 months ago
udemy_data (14).xlsx,https://www.udemy.com/course/n8n-course/?couponCode=MT250929G3,n8n-course,Wendell C.,so far its going well,5.0,5.0,2 months ago
udemy_data (14).xlsx,https://www.udemy.com/course/n8n-course/?couponCode=MT250929G3,n8n-course,Jonathan David O.,"Hello, I would like to have subtitles available in Portuguese.",4.5,5.0,3 weeks ago
udemy_data (14).xlsx,https://www.udemy.com/course/n8n-course/?couponCode=MT250929G3,n8n-course,Adetoro C.,I love the breakdown and explanation of the courses. Good value for money.,4.0,5.0,4 months ago
udemy_data (14).xlsx,https://www.udemy.com/course/n8n-course/?couponCode=MT250929G3,n8n-course,INO003 I.,I m just discovering. Correct so far,3.5,5.0,1 month ago
udemy_data (14).xlsx,https://www.udemy.com/course/n8n-course/?couponCode=MT250929G3,n8n-course,Markel T.,"Awful accent, I'm tempting to unroll the course just because of that",1.0,5.0,4 months ago
udemy_data (14).xlsx,https://www.udemy.com/course/n8n-course/?couponCode=MT250929G3,n8n-course,Roger M.,yes I knew a little about n8n but I see how it can be helpful in my job,4.5,5.0,2 months ago
udemy_data (14).xlsx,https://www.udemy.com/course/n8n-course/?couponCode=MT250929G3,n8n-course,Shohan P.,It's very helpful for startup-level Ai automation guys to learning. Thank You team,4.5,5.0,2 months ago
udemy_data (14).xlsx,https://www.udemy.com/course/n8n-course/?couponCode=MT250929G3,n8n-course,Brian L.,Good Stuff!!!!,5.0,5.0,1 week ago
udemy_data (14).xlsx,https://www.udemy.com/course/n8n-course/?couponCode=MT250929G3,n8n-course,Smith H.,Yes it was a good one,4.5,5.0,3 weeks ago
udemy_data (14).xlsx,https://www.udemy.com/course/n8n-course/?couponCode=MT250929G3,n8n-course,Vivekanand A.,Very fascinating,5.0,5.0,1 month ago
udemy_data (14).xlsx,https://www.udemy.com/course/n8n-course/?couponCode=MT250929G3,n8n-course,William L.,"Great Course, Keep up the good work !!!",4.0,5.0,2 weeks ago
udemy_data (14).xlsx,https://www.udemy.com/course/n8n-course/?couponCode=MT250929G3,n8n-course,Orlando Gallegos A.,looks good,5.0,5.0,1 month ago
udemy_data (14).xlsx,https://www.udemy.com/course/n8n-course/?couponCode=MT250929G3,n8n-course,Syed Owais Z.,so far so good. I have just begun so lets see how things go.,5.0,5.0,2 weeks ago
udemy_data (14).xlsx,https://www.udemy.com/course/n8n-course/?couponCode=MT250929G3,n8n-course,Vineeth H.,good,4.5,5.0,1 month ago
udemy_data (14).xlsx,https://www.udemy.com/course/n8n-course/?couponCode=MT250929G3,n8n-course,Abeer J.,"the accent is not very good, and there are no captions",3.5,5.0,2 months ago
udemy_data (14).xlsx,https://www.udemy.com/course/n8n-course/?couponCode=MT250929G3,n8n-course,José Andrés Bardales C.,Para ser tu primer curso está increible!!!,5.0,5.0,5 months ago
udemy_data (14).xlsx,https://www.udemy.com/course/n8n-course/?couponCode=MT250929G3,n8n-course,Priyanka G.,good,5.0,5.0,1 month ago
udemy_data (14).xlsx,https://www.udemy.com/course/n8n-course/?couponCode=MT250929G3,n8n-course,Aparajita K.,Very well explained,5.0,5.0,2 weeks ago
udemy_data (14).xlsx,https://www.udemy.com/course/n8n-course/?couponCode=MT250929G3,n8n-course,kwantu T.,"Great intro, Love it.",5.0,5.0,1 week ago
udemy_data (14).xlsx,https://www.udemy.com/course/n8n-course/?couponCode=MT250929G3,n8n-course,Kay W.,This course is excellent for anyone new to the industry. It offers a wealth of resources to support your learning journey.,5.0,5.0,4 months ago
