source_file,course_url,course_slug,reviewer_name,review_text,rating_value,rating_scale,review_time_relative
udemy_data (10).xlsx,https://www.udemy.com/course/the-product-management-for-data-science-ai-course/?couponCode=MT250929G3,the-product-management-for-data-science-ai-course,Amy G.,This is a great course for those that work with data looking to upgrade their skills into product management.,5.0,5.0,4 years ago
udemy_data (10).xlsx,https://www.udemy.com/course/the-product-management-for-data-science-ai-course/?couponCode=MT250929G3,the-product-management-for-data-science-ai-course,Flavio P.,Não era o que eu esperava. Muito básico e faltou muito material de estudo(Recursos) sobre o assunto. Muito fraco as referencias que estão lá para baixar ou links pra ler.,3.0,5.0,4 years ago
udemy_data (10).xlsx,https://www.udemy.com/course/the-product-management-for-data-science-ai-course/?couponCode=MT250929G3,the-product-management-for-data-science-ai-course,Dikeledi S.,"The instructor has good energy, and i also like the highlights on the screen. It makes the course to be interactive.",5.0,5.0,5 years ago
udemy_data (10).xlsx,https://www.udemy.com/course/the-product-management-for-data-science-ai-course/?couponCode=MT250929G3,the-product-management-for-data-science-ai-course,Susan H.,"No, this was not a course that pertained to my career field or that I was interested in.",3.5,5.0,2 years ago
udemy_data (10).xlsx,https://www.udemy.com/course/the-product-management-for-data-science-ai-course/?couponCode=MT250929G3,the-product-management-for-data-science-ai-course,Sharanya,Very Informative and the content was crystal clear to understand the topic. Good course.,5.0,5.0,1 year ago
udemy_data (10).xlsx,https://www.udemy.com/course/the-product-management-for-data-science-ai-course/?couponCode=MT250929G3,the-product-management-for-data-science-ai-course,Michael S.,This is a great course for Project leads/Managers that are use old methods of software development. Danielle Thé is very professional and reinforces the Project managers roles,5.0,5.0,2 years ago
udemy_data (10).xlsx,https://www.udemy.com/course/the-product-management-for-data-science-ai-course/?couponCode=MT250929G3,the-product-management-for-data-science-ai-course,Anonymized U.,Yes. Excellent introduction also for beginners. Instructor explains step-by-step theoretical basis in combination w/ representative business examples.,5.0,5.0,4 years ago
udemy_data (10).xlsx,https://www.udemy.com/course/the-product-management-for-data-science-ai-course/?couponCode=MT250929G3,the-product-management-for-data-science-ai-course,Nitin S.,"Very human explanation of AI PM, highly recommended for even exec level audiences.",5.0,5.0,3 years ago
udemy_data (10).xlsx,https://www.udemy.com/course/the-product-management-for-data-science-ai-course/?couponCode=MT250929G3,the-product-management-for-data-science-ai-course,Anonymized U.,Very well designed course that covers everything a product manager for AI should know.,5.0,5.0,2 years ago
udemy_data (10).xlsx,https://www.udemy.com/course/the-product-management-for-data-science-ai-course/?couponCode=MT250929G3,the-product-management-for-data-science-ai-course,Kyle,AI and data science really does not play apart in my role in the Government for the acquisitions I work on.,2.5,5.0,2 years ago
udemy_data (10).xlsx,https://www.udemy.com/course/the-product-management-for-data-science-ai-course/?couponCode=MT250929G3,the-product-management-for-data-science-ai-course,Richard T Y.,The instructor is very knowledgeable and good explainer,4.5,5.0,1 year ago
udemy_data (10).xlsx,https://www.udemy.com/course/the-product-management-for-data-science-ai-course/?couponCode=MT250929G3,the-product-management-for-data-science-ai-course,Kaushalendra P.,"The lectures are too long and totally text based, it seems like the teacher is reading a book.",2.5,5.0,1 year ago
udemy_data (10).xlsx,https://www.udemy.com/course/the-product-management-for-data-science-ai-course/?couponCode=MT250929G3,the-product-management-for-data-science-ai-course,Frankie A.,Great Course So Far. The course so far has provided lots of great information.,5.0,5.0,2 years ago
udemy_data (10).xlsx,https://www.udemy.com/course/the-product-management-for-data-science-ai-course/?couponCode=MT250929G3,the-product-management-for-data-science-ai-course,Anonymized U.,"As a person in a technical role, this course is really helping me think beyond the numbers and focus more on the why's and how's, and to take more ownership of my area of expertise.",4.5,5.0,4 years ago
udemy_data (10).xlsx,https://www.udemy.com/course/the-product-management-for-data-science-ai-course/?couponCode=MT250929G3,the-product-management-for-data-science-ai-course,Manzoor A.,Very informative for a PM and PMs aspiring for transition to AI PM,4.5,5.0,4 years ago
udemy_data (10).xlsx,https://www.udemy.com/course/the-product-management-for-data-science-ai-course/?couponCode=MT250929G3,the-product-management-for-data-science-ai-course,Frank N.,The tutor has broken a would be complex topics into easily digestible chunks.,5.0,5.0,1 year ago
udemy_data (10).xlsx,https://www.udemy.com/course/the-product-management-for-data-science-ai-course/?couponCode=MT250929G3,the-product-management-for-data-science-ai-course,Anonymized U.,"Really good content and information for product managers, but the presentation style makes it hard to get through. The trainer needs a lot of work with reading off a teleprompter because the way she stumbles through it is actually really distracting and detracts from the content.",4.0,5.0,4 years ago
udemy_data (10).xlsx,https://www.udemy.com/course/the-product-management-for-data-science-ai-course/?couponCode=MT250929G3,the-product-management-for-data-science-ai-course,Marc Hernandez F.,"Needs more exercises or at least a difficult case to solve, otherwise well explained",3.5,5.0,3 years ago
udemy_data (10).xlsx,https://www.udemy.com/course/the-product-management-for-data-science-ai-course/?couponCode=MT250929G3,the-product-management-for-data-science-ai-course,Srishti G.,Good coverage of material but lacks in depth knowledge and hands-on assignments,3.5,5.0,2 years ago
udemy_data (10).xlsx,https://www.udemy.com/course/the-product-management-for-data-science-ai-course/?couponCode=MT250929G3,the-product-management-for-data-science-ai-course,Giovanni P.,La docente é straordinariamente brillante e preparata. Personalmente mi sento molto coinvolto e stimolato!,5.0,5.0,4 years ago
udemy_data (10).xlsx,https://www.udemy.com/course/the-product-management-for-data-science-ai-course/?couponCode=MT250929G3,the-product-management-for-data-science-ai-course,Paulo A.,Real insights of real business are explained in a simple way making it possible to extrapolate to current project,5.0,5.0,2 years ago
udemy_data (10).xlsx,https://www.udemy.com/course/the-product-management-for-data-science-ai-course/?couponCode=MT250929G3,the-product-management-for-data-science-ai-course,Simon G.,I am just starting to learn a bit more here at section 5. This can be explained because I am already in the field of product management so the first sections were more of the same stuff I have already learned. I want to transition into AI & Data so section 5 going forward is much more what I am looking forward to.,4.0,5.0,1 year ago
udemy_data (10).xlsx,https://www.udemy.com/course/the-product-management-for-data-science-ai-course/?couponCode=MT250929G3,the-product-management-for-data-science-ai-course,William R E.,sort of monotone in delivery. It would be good to have to practical knowledge tests.,4.0,5.0,2 years ago
udemy_data (10).xlsx,https://www.udemy.com/course/the-product-management-for-data-science-ai-course/?couponCode=MT250929G3,the-product-management-for-data-science-ai-course,Hariharan R.,"I had completed the course but I did not get any certificate, kindly help",4.5,5.0,5 years ago
udemy_data (10).xlsx,https://www.udemy.com/course/the-product-management-for-data-science-ai-course/?couponCode=MT250929G3,the-product-management-for-data-science-ai-course,Humberto L.,I've learn tons about AI. I think it's a great course to understand how it works and apply Product Management knowledge to this new tech using simple terms and analogies.,5.0,5.0,1 year ago
udemy_data (10).xlsx,https://www.udemy.com/course/the-product-management-for-data-science-ai-course/?couponCode=MT250929G3,the-product-management-for-data-science-ai-course,Shraddha D.,Demo of tools and their knowledge must be an added advantage.,3.5,5.0,3 years ago
udemy_data (10).xlsx,https://www.udemy.com/course/the-product-management-for-data-science-ai-course/?couponCode=MT250929G3,the-product-management-for-data-science-ai-course,Olaniyi A.,"I enjoy the delivery, very easy to understand and looks quite detailed",5.0,5.0,1 year ago
udemy_data (10).xlsx,https://www.udemy.com/course/the-product-management-for-data-science-ai-course/?couponCode=MT250929G3,the-product-management-for-data-science-ai-course,Margaret H.,"The total presentation was impressive, from the technical knowledge to the instructor. Very professional presentation.",5.0,5.0,2 years ago
udemy_data (10).xlsx,https://www.udemy.com/course/the-product-management-for-data-science-ai-course/?couponCode=MT250929G3,the-product-management-for-data-science-ai-course,TAN GEOK ANG,Thanks. Quite a lots of information and real practices are needed,4.0,5.0,3 years ago
udemy_data (10).xlsx,https://www.udemy.com/course/the-product-management-for-data-science-ai-course/?couponCode=MT250929G3,the-product-management-for-data-science-ai-course,Velan M.,"Excellent, clear, thorough and precise presentation delivery by Danielle!",5.0,5.0,2 years ago
udemy_data (10).xlsx,https://www.udemy.com/course/the-product-management-for-data-science-ai-course/?couponCode=MT250929G3,the-product-management-for-data-science-ai-course,Ng Swee K.,Easy to follow and straight to the point. I recommend this course.,5.0,5.0,2 years ago
udemy_data (10).xlsx,https://www.udemy.com/course/the-product-management-for-data-science-ai-course/?couponCode=MT250929G3,the-product-management-for-data-science-ai-course,Jo-An R.,"Yes, definitely! The topics are aligned to my expectations performing a product manager role at the same building skills and managing Data and AI product.",5.0,5.0,1 year ago
udemy_data (10).xlsx,https://www.udemy.com/course/the-product-management-for-data-science-ai-course/?couponCode=MT250929G3,the-product-management-for-data-science-ai-course,Arjun W.,"Very crisp explanation by the instructor, loved this course!",5.0,5.0,2 years ago
udemy_data (10).xlsx,https://www.udemy.com/course/the-product-management-for-data-science-ai-course/?couponCode=MT250929G3,the-product-management-for-data-science-ai-course,Viswanath N.,The course provided some great insights into AI product management,5.0,5.0,3 years ago
udemy_data (10).xlsx,https://www.udemy.com/course/the-product-management-for-data-science-ai-course/?couponCode=MT250929G3,the-product-management-for-data-science-ai-course,Sharon S.,Danielle summarizes everything in an obvious and ground level.,4.5,5.0,1 year ago
udemy_data (10).xlsx,https://www.udemy.com/course/the-product-management-for-data-science-ai-course/?couponCode=MT250929G3,the-product-management-for-data-science-ai-course,Ohmar W.,The lessons are great to learn. The PM instructor briefed the lessons clearly. I will not be applying the AI technology in my work. Overall great knowledge to learn the benifit of AI.,4.0,5.0,2 years ago
udemy_data (10).xlsx,https://www.udemy.com/course/the-product-management-for-data-science-ai-course/?couponCode=MT250929G3,the-product-management-for-data-science-ai-course,Deepak K.,It’s really really good for any product managers who aspire to manage AI/ML related products or projects. This course gave all essential information to equip them to do so.,4.5,5.0,2 years ago
udemy_data (10).xlsx,https://www.udemy.com/course/the-product-management-for-data-science-ai-course/?couponCode=MT250929G3,the-product-management-for-data-science-ai-course,Anonymized U.,I have been working in project and portfolio management for 20+ years and now have a role where I own the IT Project and Product Management functions.,4.5,5.0,4 years ago
udemy_data (10).xlsx,https://www.udemy.com/course/the-product-management-for-data-science-ai-course/?couponCode=MT250929G3,the-product-management-for-data-science-ai-course,Luz de María G.,"Muy completo, bien explicado, se nota la experiencia de la instructora. Excelente!",5.0,5.0,1 year ago
udemy_data (10).xlsx,https://www.udemy.com/course/the-product-management-for-data-science-ai-course/?couponCode=MT250929G3,the-product-management-for-data-science-ai-course,Ogundeko T.,Yes. The Module or project should contain more exercise so one can test once ability to remember,4.5,5.0,1 year ago
udemy_data (10).xlsx,https://www.udemy.com/course/the-product-management-for-data-science-ai-course/?couponCode=MT250929G3,the-product-management-for-data-science-ai-course,J S.,Clear. Helpful context and examples. Very thorough. Easy to understand verbal and visual explanations.,5.0,5.0,1 year ago
udemy_data (10).xlsx,https://www.udemy.com/course/the-product-management-for-data-science-ai-course/?couponCode=MT250929G3,the-product-management-for-data-science-ai-course,Robert W.,Yes I am in the Small Business Innovative Research Army program and many are proposing AI/ML solutions.,5.0,5.0,2 years ago
udemy_data (10).xlsx,https://www.udemy.com/course/the-product-management-for-data-science-ai-course/?couponCode=MT250929G3,the-product-management-for-data-science-ai-course,Anonymized U.,Great insights. Good examples. Great way of narrating. Loved the course.,4.5,5.0,1 year ago
udemy_data (10).xlsx,https://www.udemy.com/course/the-product-management-for-data-science-ai-course/?couponCode=MT250929G3,the-product-management-for-data-science-ai-course,Sandeep Kumar S.,course content is awesome and presenter is also very good. I am enjoying and understanding the course very effectively. Thank you for creating this course.,5.0,5.0,4 years ago
udemy_data (10).xlsx,https://www.udemy.com/course/the-product-management-for-data-science-ai-course/?couponCode=MT250929G3,the-product-management-for-data-science-ai-course,LEO SAM HON ANDY,Interesting course. Key concepts of AI and tied it in very well with management principles and techniques.,5.0,5.0,4 years ago
udemy_data (10).xlsx,https://www.udemy.com/course/the-product-management-for-data-science-ai-course/?couponCode=MT250929G3,the-product-management-for-data-science-ai-course,Volha S.,Good guide to understand the core ideas. Sadly parts of videos and links are not available.,4.5,5.0,1 year ago
udemy_data (10).xlsx,https://www.udemy.com/course/the-product-management-for-data-science-ai-course/?couponCode=MT250929G3,the-product-management-for-data-science-ai-course,Anonymized U.,Very helpful course. Probably the best Udemy course I've yet taken .,5.0,5.0,3 years ago
udemy_data (10).xlsx,https://www.udemy.com/course/the-product-management-for-data-science-ai-course/?couponCode=MT250929G3,the-product-management-for-data-science-ai-course,John E.,Good over view of product manager job as well as tools and techniques.,3.0,5.0,4 years ago
udemy_data (10).xlsx,https://www.udemy.com/course/the-product-management-for-data-science-ai-course/?couponCode=MT250929G3,the-product-management-for-data-science-ai-course,Donato V.,Danielle is great. You should check out her YouTube channel too!,5.0,5.0,4 years ago
udemy_data (10).xlsx,https://www.udemy.com/course/the-product-management-for-data-science-ai-course/?couponCode=MT250929G3,the-product-management-for-data-science-ai-course,Elizabeth H.,"The videos are great, but the quizzes are non-sensical. The questions (or statements, really) don't provide any information that allows one to answer them. Therefore, they don't actually test comprehension/retention of material.",1.5,5.0,1 year ago
udemy_data (10).xlsx,https://www.udemy.com/course/the-product-management-for-data-science-ai-course/?couponCode=MT250929G3,the-product-management-for-data-science-ai-course,Kapil P.,"Exactly what I was looking for. I am a Product Manager in Tech and it's becoming increasingly important to leverage AI for discovering new capabilities in the product. But before we even do that, it's important to know what exactly AI is and what it can and cannot do. I stumbled upon this course in my quest to learn more about AI and apply it to my job. I am blown away. This is an amazing course if you're someone like me, who wants to start with an ELI5 style learning into the world of AI.",5.0,5.0,2 years ago
udemy_data (10).xlsx,https://www.udemy.com/course/the-product-management-for-data-science-ai-course/?couponCode=MT250929G3,the-product-management-for-data-science-ai-course,Nina R.,"Like the concise way of each lesson, they are not too long and right on the point.",4.5,5.0,2 years ago
udemy_data (10).xlsx,https://www.udemy.com/course/the-product-management-for-data-science-ai-course/?couponCode=MT250929G3,the-product-management-for-data-science-ai-course,José Maria Guimarães Ramirez F.,The speaker is very clear and the information is well structured.,5.0,5.0,2 years ago
udemy_data (10).xlsx,https://www.udemy.com/course/the-product-management-for-data-science-ai-course/?couponCode=MT250929G3,the-product-management-for-data-science-ai-course,Jean Rony C.,It is a fantastic match to what my interest is. Because I want to tap into the role of A.I & ML Product Manager.,5.0,5.0,2 years ago
udemy_data (10).xlsx,https://www.udemy.com/course/the-product-management-for-data-science-ai-course/?couponCode=MT250929G3,the-product-management-for-data-science-ai-course,Ankit N.,It's a very high level need more examples and real practical examples,3.5,5.0,5 years ago
udemy_data (10).xlsx,https://www.udemy.com/course/the-product-management-for-data-science-ai-course/?couponCode=MT250929G3,the-product-management-for-data-science-ai-course,Ramakrishna K.,"Good, the tutor has done justice. But she can have more elegant dresses for the presentation",4.5,5.0,1 year ago
udemy_data (10).xlsx,https://www.udemy.com/course/the-product-management-for-data-science-ai-course/?couponCode=MT250929G3,the-product-management-for-data-science-ai-course,Anantajit B.,The kind of details and practical tips covered in this course are the icing on the cake! The course itself is very well structured and coverage of topics is fantastic for someone who is familar with Product Management but not with AI/ML. The instructor is very easy to follow and is very lucid in her presentation. Great job on this course!!!,5.0,5.0,1 year ago
udemy_data (10).xlsx,https://www.udemy.com/course/the-product-management-for-data-science-ai-course/?couponCode=MT250929G3,the-product-management-for-data-science-ai-course,Seba Al S.,It is precisely what I need and is an excellent introduction to the topic.,4.5,5.0,3 years ago
udemy_data (10).xlsx,https://www.udemy.com/course/the-product-management-for-data-science-ai-course/?couponCode=MT250929G3,the-product-management-for-data-science-ai-course,Anonymized U.,well organized and explanation of concepts is top notch. Thank you.,5.0,5.0,2 years ago
udemy_data (10).xlsx,https://www.udemy.com/course/the-product-management-for-data-science-ai-course/?couponCode=MT250929G3,the-product-management-for-data-science-ai-course,Suraj S.,It is a great match for what I am looking at. The focus on AI along with Product management view was what I was looking for and I got it here.,5.0,5.0,4 years ago
udemy_data (10).xlsx,https://www.udemy.com/course/the-product-management-for-data-science-ai-course/?couponCode=MT250929G3,the-product-management-for-data-science-ai-course,Patrick F.,The information and techniques are very useful to product managers of all types.,4.0,5.0,2 years ago
udemy_data (10).xlsx,https://www.udemy.com/course/the-product-management-for-data-science-ai-course/?couponCode=MT250929G3,the-product-management-for-data-science-ai-course,Anonymized U.,Great course to learn Product management with AI.,5.0,5.0,1 year ago
udemy_data (10).xlsx,https://www.udemy.com/course/the-product-management-for-data-science-ai-course/?couponCode=MT250929G3,the-product-management-for-data-science-ai-course,Joselyn R.,I will prefer additional visual tools other than 1 person just talking the points,3.0,5.0,2 years ago
udemy_data (10).xlsx,https://www.udemy.com/course/the-product-management-for-data-science-ai-course/?couponCode=MT250929G3,the-product-management-for-data-science-ai-course,Nonna S.,"What is a standard audience for this course? Questioning whether this is suited for actual work professionals. So far, nothing worth my time.",1.5,5.0,2 years ago
udemy_data (10).xlsx,https://www.udemy.com/course/the-product-management-for-data-science-ai-course/?couponCode=MT250929G3,the-product-management-for-data-science-ai-course,Osagie N.,Wonderful course. Learned a lot of new stuff. Didn't believe a course as short as this would pack so much information. Thank you for putting this together.,5.0,5.0,4 years ago
udemy_data (10).xlsx,https://www.udemy.com/course/the-product-management-for-data-science-ai-course/?couponCode=MT250929G3,the-product-management-for-data-science-ai-course,Armando R.,Watching a person brief the course material made it more engaging.,5.0,5.0,2 years ago
udemy_data (10).xlsx,https://www.udemy.com/course/the-product-management-for-data-science-ai-course/?couponCode=MT250929G3,the-product-management-for-data-science-ai-course,Nittish V.,some more depth around core stat areas would have been better,4.0,5.0,4 years ago
udemy_data (10).xlsx,https://www.udemy.com/course/the-product-management-for-data-science-ai-course/?couponCode=MT250929G3,the-product-management-for-data-science-ai-course,Jigar J.,Very well explained by Danielle by giving practical examples and by reducing the complexity of each topic.,5.0,5.0,1 year ago
udemy_data (10).xlsx,https://www.udemy.com/course/the-product-management-for-data-science-ai-course/?couponCode=MT250929G3,the-product-management-for-data-science-ai-course,Lydia C.,"The concepts were explained clearly, and even complex topics were broken down into manageable, understandable segments—truly above my expectations",5.0,5.0,2 years ago
udemy_data (10).xlsx,https://www.udemy.com/course/the-product-management-for-data-science-ai-course/?couponCode=MT250929G3,the-product-management-for-data-science-ai-course,Goodman George C. J.,This was a great class and will refer to the resources in the future.,5.0,5.0,2 years ago
udemy_data (10).xlsx,https://www.udemy.com/course/the-product-management-for-data-science-ai-course/?couponCode=MT250929G3,the-product-management-for-data-science-ai-course,Gabor H.,"Yes, I think I by chance find the appropriate course. Itrsection of business - tech - UX is very interesting to me.",4.0,5.0,1 year ago
udemy_data (10).xlsx,https://www.udemy.com/course/the-product-management-for-data-science-ai-course/?couponCode=MT250929G3,the-product-management-for-data-science-ai-course,Scott H. G.,"Yes, I deal with Product Managers on a weekly basis and this course is significantly helping to broaden my knowledge.",5.0,5.0,2 years ago
udemy_data (10).xlsx,https://www.udemy.com/course/the-product-management-for-data-science-ai-course/?couponCode=MT250929G3,the-product-management-for-data-science-ai-course,Anirudh R.,"It's a bit distracting to view the speaker, and not slides/ notes. The speaker view can be much smaller - to the bottom right maybe.",3.0,5.0,1 year ago
udemy_data (10).xlsx,https://www.udemy.com/course/the-product-management-for-data-science-ai-course/?couponCode=MT250929G3,the-product-management-for-data-science-ai-course,Marvin Leroy H.,I am taking this course to enhance my career and to provide me with better opportunities. This is one of many courses I will be taking through Udemy studies provided by my organization.,5.0,5.0,2 years ago
udemy_data (10).xlsx,https://www.udemy.com/course/the-product-management-for-data-science-ai-course/?couponCode=MT250929G3,the-product-management-for-data-science-ai-course,Sashikanth V.,"Yes, I wish there were quick quizzes after sections",4.5,5.0,2 years ago
udemy_data (10).xlsx,https://www.udemy.com/course/the-product-management-for-data-science-ai-course/?couponCode=MT250929G3,the-product-management-for-data-science-ai-course,Anurag J.,"It so resembles with my skills (Jack of all trades, master of none).",4.5,5.0,4 years ago
udemy_data (10).xlsx,https://www.udemy.com/course/the-product-management-for-data-science-ai-course/?couponCode=MT250929G3,the-product-management-for-data-science-ai-course,Christian H.,"Der Kurs verspricht Lösungen für die Probleme, die mir aus der Praxis bekannt sind.",5.0,5.0,2 years ago
udemy_data (10).xlsx,https://www.udemy.com/course/the-product-management-for-data-science-ai-course/?couponCode=MT250929G3,the-product-management-for-data-science-ai-course,Nikita I.,Really great content and excellent case studies.,4.0,5.0,3 years ago
udemy_data (10).xlsx,https://www.udemy.com/course/the-product-management-for-data-science-ai-course/?couponCode=MT250929G3,the-product-management-for-data-science-ai-course,Donald C. S.,Yes it has been a good match for me to learn more about AI and Data Science PM,5.0,5.0,2 years ago
udemy_data (10).xlsx,https://www.udemy.com/course/the-product-management-for-data-science-ai-course/?couponCode=MT250929G3,the-product-management-for-data-science-ai-course,Jose R.,"Loved this course, thank you very much.",5.0,5.0,3 years ago
